question,answers,gen_answer,truth,,,
What is a mechanical barrier in insects that protects the insect?,"['exoskeleton', 'exoskeleton', 'exoskeleton']",The exoskeleton of insects is a mechanical barrier that protects the insect.,1,,,
Who is on the IPCC Panel?,"['representatives appointed by governments and organizations', 'representatives appointed by governments and organizations', 'representatives appointed by governments and organizations']","Representatives appointed by governments and organizations, with participation of delegates with appropriate expertise encouraged.",1,,,
How many people attended the 2003 IPCC meeting?,"['350', '350', '350']","According to the context, 350 government officials and climate change experts attended the 2003 meeting.",1,,,
How much of the IPCC attendees are government representatives?,"['about seven-eighths', 'seven-eighths', 'about seven-eighths']","About seven-eighths of the participants, which is approximately 7/8 or 0.875, were from governmental organizations.",1,,,
"In a computational problem, what can be described as a string over an alphabet?","['problem instance', 'a problem instance', 'problem instance']",A problem instance in a computational problem can be described as a string over an alphabet.,1,,,
What is the name of the alphabet is most commonly used in a problem instance?,"['binary alphabet', 'binary', 'binary']","The binary alphabet, which is the set {0,1}.",1,,,
What is another term for the string of a problem instance?,"['bitstrings', 'bitstrings', 'bitstrings']",A problem instance is also referred to as a bitstring.,1,,,
"In the encoding of mathematical objects, what is the way in which integers are commonly expressed?","['binary notation', 'binary notation', 'binary notation']","In the encoding of mathematical objects, integers are commonly expressed in binary notation.",1,,,
What is one way in which graphs can be encoded? ,"['adjacency matrices', 'directly via their adjacency matrices']",One way to encode graphs is by using their adjacency matrices in binary.,1,,,
Who wrote that it is difficult to produce an all inclusive definition of civil disobedience?,"['LeGrande', 'LeGrande', 'LeGrande', 'LeGrande', 'LeGrande']","LeGrande wrote that it is extremely difficult, if not impossible, to formulate a single all-encompassing definition of the term ""civil disobedience"".",1,,,
Le Grande also wrote that defining the term civil disobedience so difficult it could be described as? ,"['impossible', 'a maze of semantical problems and grammatical niceties', 'impossible', 'impossible']","""extremely difficult, if not impossible"".",1,,,
Le grand asks for a variance of what three terms?,"['lawful protest demonstration, nonviolent civil disobedience, and violent civil disobedience', 'lawful protest demonstration, nonviolent civil disobedience, and violent civil disobedience', 'lawful protest demonstration, nonviolent civil disobedience, and violent civil disobedience', 'lawful protest demonstration, nonviolent civil disobedience, and violent civil disobedience', 'lawful protest demonstration, nonviolent civil disobedience, and violent civil disobedience']","LeGrande asks for a variance of definition, formulation, and term.",0,,,
Le grand states that students studying civil disobedience will often run into grammatical niceties and what other problem? ,"['semantical', 'semantical', 'a maze of semantical problems', 'semantical', 'semantical problems']",semantical problems,1,,,
Le grand concludes that an author's words offer only what they intended for them to imply regarding this type of terminology?,"['specific', 'civil disobedience', 'specific', 'specific']","According to LeGrande, an author's words offer only what they intend them to imply regarding the terminology of civil disobedience, meaning that the meaning is subjective and dependent on the individual orator's intention.",1,,,
Who said that writing a good description of civil disobedience is hard?,"['LeGrande', 'LeGrande', 'LeGrande', 'LeGrande', 'LeGrande']",LeGrande,1,,,
How much literature has been written regarding civil disobedience?,"['voluminous literature', 'voluminous', 'voluminous', 'voluminous']","According to the text, the literature on civil disobedience is ""voluminous"".",1,,,
What issue plagues the literature about civil disobedience?,"['semantical problems and grammatical niceties', 'maze of semantical problems and grammatical niceties', 'semantical problems and grammatical niceties', 'semantical problems and grammatical niceties']","According to LeGrande, the issue plaguing the literature about civil disobedience is the difficulty in formulating a single all-encompassing definition of the term due to semantical problems and grammatical niceties.",1,,,
What type of protest falls under civil disobedience without aggression?,"['nonviolent civil disobedience', 'nonviolent civil disobedience', 'nonviolent', 'nonviolent', 'nonviolent']",Nonviolent civil disobedience.,1,,,
What type of civil disobedience is accompanied by aggression?,"['violent civil disobedience', 'violent civil disobedience', 'violent', 'violent', 'violent']","According to the text, violent civil disobedience is accompanied by aggression.",1,,,
What president eliminated the Christian position in the curriculum?,"['Charles W. Eliot', 'Charles W. Eliot', 'Charles W. Eliot']","Charles W. Eliot, president of Harvard University from 1869 to 1909, eliminated the favored position of Christianity from the curriculum.",1,,,
What conviction motivated Eliot to move towards secularization?,"['Transcendentalist Unitarian', 'Transcendentalist Unitarian', 'Transcendentalist Unitarian']","Transcendentalist Unitarian convictions, specifically the dignity and worth of human nature, the right and ability of each person to perceive truth, and the indwelling God in each person.",1,,,
From whom were the movement that Eliot followed derived?,"['William Ellery Channing and Ralph Waldo Emerson', 'William Ellery Channing and Ralph Waldo Emerson', 'William Ellery Channing and Ralph Waldo Emerson']",The movement that Ellie followed was derived from William Ellery Channing and Ralph Waldo Emerson.,1,,,
Vice President Agnew describes Civil disobedience in what activities?,"['muggers, arsonists, draft evaders, campaign hecklers, campus militants, anti-war demonstrators, juvenile delinquents and political assassins', 'civil disobedience', 'muggers, arsonists, draft evaders, campaign hecklers, campus militants, anti-war demonstrators, juvenile delinquents and political assassins', 'muggers, arsonists, draft evaders, campaign hecklers, campus militants, anti-war demonstrators, juvenile delinquents and political assassins', 'activities of muggers, arsonists, draft evaders, campaign hecklers, campus militants, anti-war demonstrators, juvenile delinquents and political assassins']","Vice President Agnew describes civil disobedience in activities such as muggers, arsonists, draft evaders, campaign hecklers, campus militants, anti-war demonstrators, juvenile delinquents, and political assassins.",1,,,
Civil disobedience has been argued in more recent times to have suffered from what?,"['ambiguity', 'debased', 'ambiguity', 'ambiguity', 'ambiguity']",Ambiguity and debasement.,1,,,
What person argues that civil disobedience is used to describe everything?,"['Marshall Cohen', 'Marshall Cohen', 'Marshall Cohen', 'Marshall Cohen', 'Marshall Cohen']",Marshall Cohen.,1,,,
"In modern times, what is said about civil disobedience?","['become utterly debased', 'utterly debased', 'in modern times, become utterly debased', 'become utterly debased', 'become utterly debased']","According to the text, in modern times, the term ""civil disobedience"" has become utterly debased and has been used to describe a wide range of actions, making it difficult to define.",1,,,
Who gave a negative connotation to civil disobedience in recent history?,"['Vice President Agnew', 'Vice President Agnew', 'Vice President Agnew', 'Vice President Agnew', 'Marshall Cohen']","According to the context, Marshall Cohen is the one who notes that the term ""civil disobedience"" has been used to describe everything from bringing a test-case in the federal courts to taking aim at a federal official, giving a negative connotation to the term in recent history.",1,,,
