question,answers,gen_answer,truth,,,
"who introduced modern methods of surgery, such as antiseptics, sterilization, and washing hands? brainly",Joseph Lister,"Joseph Lister introduced modern methods of surgery, such as antiseptics, sterilization, and washing hands, following the publication of his paper ""Antiseptic Principle of the Practice of Surgery"" in 1867.",1,,,
president adams,"John Quincy Adams was an American statesman who served as a diplomat, minister and ambassador to foreign nations, and treaty negotiator, United States Senator, U.S. Representative from Massachusetts, and the sixth President of the United States from 1825 to 1829.","John Quincy Adams was the sixth President of the United States, serving from 1825 to 1829.",1,,,
define semitic,"A member of any of a number of peoples of ancient southwestern Asia including the Akkadians, Phoenicians, Hebrews and Arabsb.","According to the context, a Semitic person is defined as:

""1a: a member of any of a number of peoples of ancient southwestern Asia including the Akkadians, Phoenicians, Hebrews, and Arabs; b: a descendant of these peoples.""

In simpler terms, a Semitic person refers to a member of an ethnic, cultural, or racial group who speaks or spoke a Semitic language, such as the Akkadians, Phoenicians, Hebrews, and Arabs.",1,,,
what is wudfhost service,It is a set of Microsoft tools that aid in the creation of device drivers for Windows.,The WUDFHost service is a Windows Driver Foundation (WDF) User-mode Driver Framework Host Process. It is a Windows system process that runs in user-mode and is responsible for hosting user-mode drivers.,1,,,
what is an overactive pancreas,"An overactive pancrease would produce more enzymes, but in the Islets of Langerhans, it could also produce too much insulin. Too much insulin in the blood could produce Hypoglycemia or low blood sugar.This is sometimes called pre-diabetes.","An overactive pancreas would produce more enzymes, but in the Islets of Langerhans, it could also produce too much insulin. Too much insulin in the blood could produce Hypoglycemia or low blood sugar.",1,,,
where is ATP synthase located,In the mitochondria,"ATP synthase is located in the mitochondria, specifically in the inner mitochondrial membrane.",1,,,
what kind of bond is created by the attraction between atomic particles of opposite charge?,Ionic,"Based on the context provided, I would answer:

The attraction between atomic particles of opposite charge creates an electrostatic bond.",0,,,
how much money does a athletic trainer trainer get a year,"$38,000 to $82,000 per year","According to the provided context, the median annual salary for an Athletic Trainer is $42,774.",1,,,
how long before rigor sets in,12 hour,Rigor mortis typically sets in within 1-4 hours after death.,0,,,
what is the color code for a rainbow,"In rainbow, the code for red is #FF0000, #FF7F00 for orange and #FFFF00 for yellow.","The traditional colors of the rainbow, in order, are:

1. Red (Hex: #FF0000, RGB: 255, 0, 0)
2. Orange (Hex: #FF7F00, RGB: 255, 127, 0)
3. Yellow (Hex: #FFFF00, RGB: 255, 255, 0)
4. Green (no specific code mentioned, but can be approximated as #008000 or RGB: 0, 128, 0)
5. Blue (not actually blue, but cyan, which can be approximated as #00FFFF or RGB: 0, 255, 255)
6. Indigo (no specific code mentioned)
7. Violet (no specific code mentioned)

Note that the exact color codes may vary depending on the specific implementation and device used to display the rainbow.",1,,,
charity navigator definition,Charity Navigator is an American independent charity watchdog organization that evaluates charitable organizations in the United States.,Charity Navigator is an American independent charity watchdog organization that evaluates charitable organizations in the United States. Its stated goal is to advance a more efficient and responsive philanthropic marketplace in which givers and the charities they support work in tandem to overcome the nation's and the world's most persistent challenges.,1,,,
can ativan be used for insomnia,Yes,"Yes, Ativan (lorazepam) is used for insomnia.",1,,,
who is gal rimon gameffective,Founder and ceo of gameffective.,Ellie.,0,,,
indication that a breastfed baby is getting an adequate amount of milk is,The first dark stools passed by the baby to yellow stools by Day 5 and three to four stools per day by the fourth day of life.,"According to the provided context, the indications that a breastfed baby is getting an adequate amount of milk are:

* Baby has adequate weight gain
* At least three stools per day after Day 1 and at least six wet diapers per day by Day 4
* Transition from dark to yellow stools by Day 5 and three to four stools per day by the fourth day of life
* Wet diapers: 4-5+ sopping wet diapers per day",1,,,
what degree do you have to get to a engineer,"An engineer's degree is an advanced academic degree in engineering that is conferred in Europe, some countries of Latin America, and a few institutions in the United States.","According to the context, to work in research either in industry or in academia or for a government research lab, you need to get a Ph.D.",0,,,
what year was the xbox released,2001,2001,1,,,
where is the deepest body of ocean,Mariana Trench,"The deepest body of ocean is the Mariana Trench, specifically the Challenger Deep, which is located in the Pacific Ocean.",1,,,
which is better for you aspirin or ibuprofen,Aspirin,"For those with heart problems, such as heart disease, uncontrolled high blood pressure, or previous heart attack or stroke, acetaminophen or aspirin is generally a better first option.",1,,,
what is the difference between conductivity and resistivity,"Conductivity is the electrical current flow, while resistivity is a measure of the material's ability to oppose electric current.","Conductivity is the intrinsic property of a material, whereas conductance is the extrinsic property of an object dependent on its amount/mass or physical shape and size. Conductivity is measured in siemens per meter (S/m), while conductance is measured in siemens (S).",0,,,
how soon can nausea start in pregnancy,As early as the second week of your pregnancy.,"Nausea can start as early as the second week of pregnancy, but most of the time it does not start until between the fourth and sixth weeks of pregnancy.",1,,,
what is a nata,It is the authority that provides independent assurance of technical competence through a proven network of best practice industry experts for customers who require confidence.,"Based on the context, I'm going to take a guess that ""nata"" is likely an abbreviation or acronym. Without more information, it's difficult to provide a specific answer. However, I can suggest that it might be related to the context provided, which seems to be about a shop or a travel-related topic. Could you please provide more context or clarify what ""nata"" refers to?",0,,,
what is a palliative consult,"Palliative Care Program is a specialized service providing pain and symptom management, counseling, support and guidance in navigating health care options and choices.",A palliative consult is a consultation provided by a palliative medicine specialist to relieve suffering and improve quality of life for individuals with serious illnesses.,1,,,
what is the survival rate for ovarian cancer,57% to 90%,"According to the American Cancer Society, the 5-year survival rate for ovarian cancer is around 47%.",0,,,
bible names meaning jeremy,"The meaning of name Jeremy is ""god will uplift"".","According to the context, the name Jeremy has the following meanings:

* In Israeli, the name Jeremy means ""God will uplift"".
* In Hebrew, the name Jeremy means ""May Jehovah exalt"" or ""Exalted of the Lord"".

Please let me know if you have any further questions!",1,,,
where does the nile river end/,Mediterranean Sea,The Nile River ends where it flows into the Mediterranean Sea at the north edge of Egypt.,1,,,
what county is elkader iowa in,Clayton,"Elkader, Iowa is in Clayton County.",1,,,
what does ear wax color mean,"If your wax is dark, that means the wax is filled with debris, dust, dirt, and microorganisms.","Earwax color can indicate its age and composition. Fresh earwax is typically yellow or orange, while older earwax can turn white and flaky. Dark-colored earwax, often brown, can indicate a buildup of debris, dust, and microorganisms, which may increase the risk of earwax buildup.",1,,,
executive officer meaning,"An executive officer (often abbreviated XO) is generally a person responsible for running an organization, although the exact nature of the role varies depending on the organization.","According to the context, an executive officer is defined as ""the officer second in command of a military or naval organization or vessel"" or ""the officer second in command of a military or naval organization or vessel"". In a broader sense, an executive officer is a person responsible for running an organization, and the exact nature of the role varies depending on the organization.",1,,,
lanark what county,Lanark is in Lanark County.,Lanark County,1,,,
what county is vega tx in,Oldham County,"Vega, TX is in Oldham County.",1,,,
chicago illinois is in what county,Cook,Cook County.,1,,,
is canola oil unhealthy,No,"According to the provided context, opinions about Canola oil being unhealthy are divided. Some sources, such as Katherine Zeratsky, R.D., L.D., consider Canola oil a healthy option due to its monounsaturated fat content and low levels of erucic acid. However, other sources, like Darleen Bradley, claim that Canola oil is a health hazard and not fit for human consumption.",1,,,
how many game of thrones books are there,Five books.,"There are 7 Game of Thrones books written by George R.R. Martin: A Game of Thrones, A Clash of Kings, A Storm of Swords, A Feast for Crows, A Dance with Dragons, The Winds of Winter, and A Dream of Spring.",0,,,
the iran-contra,The Iran Contra Affair began as an internal U.S. confrontation between Ronald Reagan and the Democratic Congress.,The Iran-Contra Affair was a U.S. political scandal in the 1980s involving the National Security Council (NSC) and secret weapons transactions that violated the stated public policy of the government.,1,,,
what was the inqisitions all about,An organization in the Roman Catholic Church in the past that was responsible for finding and punishing people who did not accept its beliefs and practices.,"The Inquisition was not mentioned in the provided context. The text appears to be discussing the concept of civil disobedience and the difficulty in defining it. Therefore, I cannot provide an answer to this question as it is not relevant to the given context.",0,,,
what is a requirement traceability matrix,It is a document that links requirements throughout the validation process.,A requirement traceability matrix is a document that co-relates any two-baseline documents that require a many-to-many relationship to check the completeness of the relationship. It is used to track the requirements and to check the current project requirements are met.,1,,,
which birth control method reduces the risk of pregnancy and protects from sexually transmitted infections?,The male latex or polyurethane condom and female condom.,Using a condom and a hormonal method (like the Pill) together is the best protection against both pregnancy and STDs.,1,,,
does nerve damage from chemo heal,Yes,"Nerve damage from chemotherapy can be permanent and may not heal completely. However, with proper treatment and management, some patients may experience improvement in their symptoms over time.",1,,,
uso definition,"It is a nonprofit organization that provides programs, services and live entertainment to United States service members and their families.","USO stands for:

* United Service Organizations (3 times)
* United Service Organization (1 time)
* United Services Organisation (1 time)
* Unidentified Submerged Object (1 time)
* Unit Security Officer (1 time)
* Unix Software Organization (1 time)

Additionally, USO can also refer to:

* A relative of the same generation and gender
* Pith (the soft, spongy substance in the center of the stems of many plants and trees)
* Root of the kava plant, Piper methysticum

In a broader context, USO can also refer to:

* A nonprofit organization that provides programs, services, and live entertainment to United States service members and their families
* A term used in Japanese to denote anything which is not a truth or fact",1,,,
what is mass multiplied by acceleration,Force,Force.,1,,,
what is concasse,"Concasse is a cooking term meaning to rough chop any ingredient, usually vegetables.","Concasse is a cooking term meaning to rough chop any ingredient, usually vegetables, particularly applied to tomatoes.",1,,,
harriet beecher stowe birthday,"Harriett Beecher Stowe's birthday is on June 14, 1811.","June 14, 1811",1,,,
define language deprived,"It is associated with the lack of linguistic stimuli that are necessary for the language acquisition processes in an individual, usually in a very impoverished environment.","Language deprivation refers to the lack of linguistic stimuli necessary for language acquisition, often occurring in a very impoverished environment.",1,,,
role clarity definition,Role clarity is what it is that is nursing’s alone to own as well as to define the role of each individual nurse in each domain of practice.,"Role clarity refers to the clear definition and understanding of a role, including its responsibilities, expectations, and scope of practice. It provides a sense of professional identity and enables individuals to understand their role within an organization or team.",1,,,
what does the name cull mean,Killing,"According to the provided context, the name Cull is derived from Old French origins and means to collect.",0,,,
can deadlifting make your joints sore,"Yes, Knees may be getting sore from deadlifts.","Yes, deadlifting can make your joints sore, especially if your form is not correct.",1,,,
________ is typically formed by metamorphism of a sandstone.,Quartzite,Quartzite.,1,,,
what is the meaning of impairment,"Any loss or abnormality of psychological, physiological or anatomical structure or function.","According to the context, impairment refers to ""any loss or abnormality of psychological, physiological or anatomical structure or function.""",1,,,
what time do spring semesters start,At the end of January.,"According to the context, spring semesters typically start at the end of January.",1,,,
can crl be used on fiberglass,"Yes, crl can be used on fiberglass.","Yes, CLR can be used on fiberglass.",1,,,
what is  the action of the  trapezius muscle to the scapula,"Moving, rotating, and stabilizing.","The trapezius muscle has several actions on the scapula. It elevates the scapula, which is the primary function of the muscle. Additionally, it depresses the scapula, which means it pulls it down. It also rotates the scapula downward and medially, and helps to stabilize the scapula during movements.",1,,,
oceanic crust is composed primarily of ________.,Basalts,Basalt.,1,,,
cast of hush,"Casts of Hush are Kate Siegel as Maddie,John Gallagher Jr. as Man, Michael Trucco as John, Samantha Sloyan as Sarah,Emilia Graves as Max.","The cast of Hush (2016 film) includes:

* Kate Siegel as Maddie
* John Gallagher Jr. as Man
* Michael Trucco as John
* Samantha Sloyan as Sarah
* Emilia Emma Graves as Max",1,,,
what is the tennessee state tax in nashville,"7% of state sales tax,Depending on local municipalities, the total tax rate can be as high as 9.75%.","According to the provided context, the state sales tax in Tennessee is 7.00%, and Nashville has a local option sales tax of up to 2.75%. Therefore, the total sales tax rate in Nashville is between 8.50% and 9.75%.",1,,,
starting salary of registered nurse,"$28,000-$50,000 per year","According to the context, the starting salary of a Registered Nurse can range from around $28,000-$50,000 per year on average, with an hourly wage ranging from $16.50-26.00 per hour.",1,,,
average pulse rate for male adults,60 to 100 beats a minute.,The average pulse rate for male adults is between 60 to 100 beats per minute.,1,,,
how dissolve pills faster,Some pills are completely water soluble and therefore would dissolve in water faster than other liquids which are a mixture of water with other compounds.,"To dissolve pills faster, you can try the following:

* Use plain cold water
* Avoid taking pills with milk or other food items in your stomach
* Avoid taking pills with hot water
* Consider using a liquid that is specifically designed to help dissolve pills, such as a dissolvable tablet or a liquid medication

It's also important to note that the type of pill and the ingredients used to make it can affect how quickly it dissolves. Some pills are designed to dissolve slowly, while others are designed to dissolve quickly.",1,,,
normal high temperatures des moines iowa,75A°,"According to the City of Des Moines' website, the normal high temperature in Des Moines, Iowa is around 84°F (29°C) in July, which is the warmest month.",0,,,
how many calories in fortune cookie,30 calories per one fortune cookie.,"According to the provided context, one fortune cookie contains approximately 30 calories.",1,,,
what is a signature dish,A signature dish is a dish that is closely identified with a chef or a restaurant and stands out as a prime example of that person's or establishment's cuisine.,A signature dish is a dish that is closely identified with a chef or a restaurant and stands out as a prime example of that person's or establishment's cuisine.,1,,,
another name for joy stick,The control lever of an airplane.,Controller.,0,,,
what does arm wing liposuction cost,"Between $1,500 and $5,000","According to the provided information, arm liposuction prices can run between $1,500 to $5,000, depending on the amount of fat to be removed.",1,,,
"how much does a police officer make in charleston, illinois","$34,000","According to the provided information, the average salary for a police officer in Charleston, SC is $28,000, which is 2% lower than the average salary for police officers nationwide.",0,,,
what is botdf,It was the only track from Blood on the Dance Floor.,"I apologize, but there is no information provided about ""botdf"" in the given context. Could you please provide more context or clarify what ""botdf"" refers to?",0,,,
Which name is also used to describe the Amazon rainforest in English?,"['also known in English as Amazonia or the Amazon Jungle,', 'Amazonia or the Amazon Jungle', 'Amazonia']",The Amazon rainforest is also known in English as Amazonia or the Amazon Jungle.,1,,,
How many square kilometers of rainforest is covered in the basin?,"['5,500,000 square kilometres (2,100,000 sq mi) are covered by the rainforest.', '5,500,000', '5,500,000']","According to the context, 5,500,000 square kilometers (2,100,000 sq mi) of the Amazon basin are covered by the rainforest.",1,,,
How many nations control this region in total?,"['This region includes territory belonging to nine nations.', 'nine', 'nine']",9,1,,,
"How many nations contain ""Amazonas"" in their names?","['States or departments in four nations contain ""Amazonas"" in their names.', 'four', 'four']","Four nations contain ""Amazonas"" in their names.",1,,,
What percentage does the Amazon represents in rainforests on the planet?,"[""The Amazon represents over half of the planet's remaining rainforests"", 'over half']",The Amazon represents over half of the planet's remaining rainforests.,1,,,
What is the Dutch word for the Amazon rainforest?,"['Amazoneregenwoud', 'Amazoneregenwoud', 'Amazoneregenwoud']","The Dutch word for the Amazon rainforest is ""Amazoneregenwoud"".",1,,,
What rainforest covers the majority of the Amazon basin in South America?,"['The Amazon rainforest', 'Amazon rainforest', 'The Amazon']",The Amazon rainforest covers the majority of the Amazon basin in South America.,1,,,
In what country can most of the Amazon rainforest be found?,"['Brazil', 'Brazil', 'Brazil']",Brazil.,1,,,
The Amazon rainforest makes up what amount of Earth's rainforests?,"['over half', 'over half', 'over half']",The Amazon rainforest represents over half of the planet's remaining rainforests.,1,,,
How many species of trees can be found in the Amazon rainforest?,"['16,000', '16,000', '16,000']","According to the context, there are 16,000 species of trees in the Amazon rainforest.",1,,,
What kind of forest is the Amazon rainforest?,"['moist broadleaf forest', 'moist broadleaf forest', 'tropical']",The Amazon rainforest is a moist broadleaf forest.,1,,,
How many square kilometers is the Amazon Basin?,"['7,000,000 square kilometres (2,70', '7,000,000', '7,000,000 square kilometres']","The Amazon Basin is approximately 7,000,000 square kilometers (2,700,000 sq mi).",1,,,
How many nations are within the Amazon Basin?,"['nine nations', 'nine', 'nine']","According to the context, the Amazon Basin includes territory belonging to nine nations.",1,,,
Which nation contains the majority of the amazon forest?,"['Brazil', 'Brazil', 'Brazil']",Brazil.,1,,,
Which Florida city has the biggest population?,"['Jacksonville', 'Jacksonville', 'Jacksonville']",Jacksonville.,1,,,
What was the population Jacksonville city as of 2010?,"['1,345,596', '1,345,596', '1,345,596']","1,345,596",1,,,
"Based on population alone, what is Jacksonville's ranking in the United States?","['12th', '12th', '12th']","According to the context, Jacksonville is the 12th most populous city in the United States.",1,,,
In which county does Jacksonville reside?,"['Duval', 'Duval County', 'Duval County']",Duval County,1,,,
What year did consolidation cause Jacksonville to become part of Duval County?,"['1968', '1968', '1968']",1968,1,,,
When did the 1973 oil crisis begin?,"['October 1973', 'October 1973', 'October 1973', 'October', '1973']",October 1973.,1,,,
What was the price of oil in March of 1974?,"['nearly $12', '$12', '$12', '$12', '$12']","According to the context, the price of oil had risen from US$3 per barrel to nearly $12 globally by the end of the embargo in March 1974.",1,,,
When was the second oil crisis?,"['1979', '1979', '1979', '1979', '1979']","The second oil crisis, also known as the ""second oil shock"", occurred in 1979.",1,,,
What was another term used for the oil crisis?,"['first oil shock', 'shock', 'shock', 'first oil shock', 'shock']","The ""oil shock"".",1,,,
Who proclaimed the oil embargo?,"['members of the Organization of Arab Petroleum Exporting Countries', 'members of the Organization of Arab Petroleum Exporting Countries', 'Organization of Arab Petroleum Exporting Countries', 'members of the Organization of Arab Petroleum Exporting Countries', 'OAPEC']","The members of the Organization of Arab Petroleum Exporting Countries (OAPEC), consisting of the Arab members of OPEC plus Egypt and Syria, proclaimed the oil embargo.",1,,,
Who provides the bill of quantities?,"['a quantity surveyor', 'quantity surveyor', 'quantity surveyor']",The contractor provides the bill of quantities.,1,,,
The owner typically awards a contract to who?,"['the most cost efficient bidder', 'the most cost efficient bidder', 'most cost efficient bidder']",The owner typically awards a contract to the most cost-efficient bidder.,1,,,
What process do moderate and reformist Islamists work within the boundaries of?,"['democratic', 'democratic process', 'democratic']","According to the context, moderate and reformist Islamists work within the democratic process.",1,,,
What is Southern California often abbreviated as?,"['SoCal', 'SoCal', 'SoCal']",SoCal.,1,,,
"Despite being traditionall described as ""eight counties"", how many counties does this region actually have?","['10 counties', '10', '10']","According to the context, Southern California is actually described as having 10 counties, including Kern and San Luis Obispo counties, in addition to the traditional ""eight counties"" of Imperial, Los Angeles, Orange, Riverside, San Bernardino, San Diego, Santa Barbara, and Ventura.",1,,,
What is a major importance of Southern California in relation to California and the United States?,"['economic center', 'major economic center', 'economic center']",A major economic center for the state of California and the United States.,1,,,
"What are the ties that best described what the ""eight counties"" are based on?","['demographics and economic ties', 'economic', 'demographics and economic']",Historical political divisions.,0,,,
The reasons for the las two counties to be added are based on what?,"['historical political divisions', 'historical political divisions', 'historical political divisions']",Historical political divisions.,1,,,
Who is the chair of the IPCC?,"['Hoesung Lee', 'Hoesung Lee', 'Hoesung Lee']",Korean economist Hoesung Lee.,1,,,
What nationality is Hoesung Lee?,"['Korean', 'onomist', 'Korean']","I'm happy to help! Based on the provided context, I couldn't find any information about Hoesung Lee's nationality. Could you please provide more context or clarify the question?",0,,,
Who is the vice-chair of the IPCC?,"['Ismail El Gizouli', 'Ismail El Gizouli', 'Ismail El Gizouli']","According to the context, Ismail El Gizouli was the vice-chair of the IPCC before Hoesung Lee took over as the chair.",1,,,
Who was the first chair of the IPCC?,"['Bert Bolin', 'Bert Bolin', 'Bert Bolin']","Unfortunately, the provided context does not mention the first chair of the IPCC. The context only discusses the composition of the IPCC Panel and the attendance at the 2003 meeting.",0,,,
When did Pachauri resign as chair of the IPCC?,"['February 2015', 'February 2015', 'February 2015']",February 2015.,1,,,
