question,context,answers
"who introduced modern methods of surgery, such as antiseptics, sterilization, and washing hands? brainly","[""The widespread introduction of antiseptic surgical methods followed the publishing of the paper Antiseptic Principle of the Practice of Surgery in 1867 by Joseph Lister, inspired by Louis Pasteur 's germ theory of putrefaction.""
 'Antiseptics are the substances that kill or prevent the growth of the microorganisms. The name comes from the Greek words anti (against) and sepsis (decay). Antiseptics prevent infection and other changes in living tissue by destroying or slowing the growth of germs (microorganisms that cause disease). The nature and use of anti-septics was not fully understood until the discovery of bacteria.'
 'Lister began washing his hands before operating, and wearing clean clothes. (Others such as Florence Nightingale, the pioneer of modern nursing, had already found that increased cleanliness reduced the death rate from infection among hospital patients.'
 ""1 Iodine is usually used in an alcohol solution (called tincture of iodine) or as Lugol's iodine solution as a pre-and postoperative antiseptic. 2  Some people do not recommend disinfecting minor wounds with iodine because of concern that it may induce scar tissue formation and increase healing time.""
 'None of these antiseptics, however, was sufficient to prevent the almost certain infection of wounds, particularly following surgery. Amputations, for example, were common in the 1800s, especially in the case of compound fracture (bone breaks that injure surrounding soft tissue).'
 'Even sterilization may not destroy prions. Some antiseptics are true germicides, capable of destroying microbes (bacteriocidal), while others are bacteriostatic and only prevent or inhibit their growth. Antibacterials are antiseptics that have the proven ability to act against bacteria.'
 ""Antiseptics are generally distinguished from antibiotics by the latter's ability to be transported through the lymphatic system to destroy bacteria within the body, and from disinfectants, which destroy microorganisms found on non-living objects.""
 ""Genevieve Charlotte d'Arconville introduced the use of chloride of mercury as an antiseptic in 1766. After Bernard Courtois (1777-1838) discovered iodine in 1811, it became a popular antiseptic treatment for wounds.""
 '1 It is used as a scrub for preoperative hand cleansing, and in the form of a powder as an antiseptic baby powder, where it is dusted onto the navel as it heals. 2  Also used in mouthwashes and throat lozenges, it has a painkilling effect, as well as an antiseptic one. 3  Example: TCP.'
 'Lister’s early life. Joseph Lister was born in Upton, Essex, England, on April 5, 1827. He was the second of three children born to Joseph Jackson Lister, a very successful wine merchant and amateur scientist. Joseph Jackson Lister’s design of a microscope lens which did not distort colours opened the way for the microscope to be used as a serious scientific tool.']",Joseph Lister
president adams,"['Save president adams cb radio to get e-mail alerts and updates on your eBay Feed.'
 'John Quincy Adams was an American statesman who served as a diplomat, minister and ambassador to foreign nations, and treaty negotiator, United States Senator, U.S. Representative from Massachusetts, and the sixth President of the United States from 1825 to 1829. He was a member of the Federalists like his father John Adams, but later switched to the Jeffersonian Democratic-Republican, National Republican, and later the Anti-Masonic and Whig parties when they were organized. He was the son of se'
 'John Quincy Adams (/ ˈ k w ɪ n z i / ( listen); July 11, 1767 – February 23, 1848) was an American statesman who served as a diplomat, minister and ambassador to foreign nations, and treaty negotiator, United States Senator, U.S. Representative (Congressman) from Massachusetts, and the sixth President of the United States from 1825 to 1829.'
 'John Quincy Adams (/ˈkwɪnzi/ ( listen); July 11, 1767 – February 23, 1848) was an American statesman who served as a diplomat, United States Senator, member of the House of Representatives, and was the sixth President of the United States from 1825 to 1829.'
 'Adams this radio has a lot of output power 50 watts and has a great layout with knobs on left and buttons on the right it also has a great scan feature that i use alot this radio also has sideband that works great with the power'
 'John Quincy Adams (/ˈkwɪnzi/; July 11, 1767 – February 23, 1848) was an American statesman who served as a diplomat, United States Senator, member of the House of Representatives, and was the sixth President of the United States from 1825 to 1829.'
 ""John Quincy Adams was born on July 11, 1767, to John Adams and his wife Abigail (née Smith) in a part of Braintree, Massachusetts that is now Quincy. He was named for his mother's maternal grandfather, Colonel John Quincy, after whom Quincy, Massachusetts, is named.""
 'this radio has a lot of output power 50 watts and has a great layout with knobs on left and buttons on the right it also has a great scan feature that i use alot this radio also has sideband that works great with the power.'
 'John Quincy Adams (/ˈkwɪnzi/ ( listen);[a] July 11, 1767 – February 23, 1848) was an American statesman who served as a diplomat, United States Senator, member of the House of Representatives, and was the sixth President of the United States from 1825 to 1829.'
 'Find great deals on eBay for president adams cb radio and adams cb. Shop with confidence.']","John Quincy Adams was an American statesman who served as a diplomat, minister and ambassador to foreign nations, and treaty negotiator, United States Senator, U.S. Representative from Massachusetts, and the sixth President of the United States from 1825 to 1829."
define semitic,"['Anti-Semitism is a certain perception of Jews, which may be expressed as hatred toward Jews. Rhetorical and physical manifestations of anti-Semitism are directed toward Jewish or non-Jewish individuals and/or their property, toward Jewish community institutions and religious facilities.. --Working Definition of Anti-Semitism by the European Monitoring Center on Racism and Xenophobia.'
 'Hostility toward Jews or discrimination against them as a group is known as anti-Semitism. The word Semite refers to a number of different peoples from southwestern Asia, including both Jews and Arabs. Anti-Semitism, however, usually refers only to discrimination against Jews.'
 'Definition of Semite. 1  1a : a member of any of a number of peoples of ancient southwestern Asia including the Akkadians, Phoenicians, Hebrews, and Arabsb : a descendant of these peoples. 2  2 : a member of a modern people speaking a Semitic language.'
 'The term Semitic most commonly refers to the Semitic languages, a name used since the 1770s to refer to the language family currently present in West Asia, North and East Africa, and Malta. Semitic may also refer to:'
 'Defining Anti-Semitism. Anti-Semitism is a certain perception of Jews, which may be expressed as hatred toward Jews. Contemporary Examples of Anti-Semitism. Calling for, aiding, or justifying the killing or harming of Jews (often in the name of a radical ideology or an extremist view of religion).'
 'The term Semitic most commonly refers to the Semitic languages, a name used since the 1770s to refer to the language family currently present in West Asia, North and East Africa, and Malta. Contents.'
 'Semitic people or Semitic cultures (from the biblical Shem, Hebrew: שם\u200e\u200e) was a term for an ethnic, cultural or racial group who speak or spoke the Semitic languages. The terminology was first used in the 1770s by members of the Göttingen School of History, who derived the name from Shem, one of the three sons of Noah in the Book of Genesis.'
 'Definition of Semite. 1a : a member of any of a number of peoples of ancient southwestern Asia including the Akkadians, Phoenicians, Hebrews, and Arabsb : a descendant of these peoples.'
 'In the racialist classifications of Carleton S. Coon, the Semitic peoples were considered to be members of the Caucasian race, not dissimilar in appearance to the neighbouring Indo-European, Northwest Caucasian, Berber and Kartvelian-speaking peoples of the region.'
 'Anti-Semitism, hostility toward or discrimination against Jews as a religious or racial group. The term anti-Semitism was coined in 1879 by the German agitator Wilhelm Marr to designate the anti-Jewish campaigns under way in central Europe at that time. Although the term now has wide currency, it is a misnomer, since it implies a discrimination against all Semites.']","A member of any of a number of peoples of ancient southwestern Asia including the Akkadians, Phoenicians, Hebrews and Arabsb."
what is wudfhost service,"['WUDFHost.exe errors can be related to corrupt or outdated device drivers. Drivers can work one day, and suddenly stop working the next day, for a variety of reasons. The good news is that you can often update the device driver to fix the EXE problem.'
 'WUDFHost.exe is a type of EXE file associated with Microsoft Windows Vista Promotional Pack developed by Microsoft for the Windows Operating System. The latest known version of WUDFHost.exe is 1.0.0.0, which was produced for Windows.'
 'What is WUDFHost.exe? Windows Driver Foundation (WDF) is a set of Microsoft tools that aid in the creation of device drivers for Windows. The User-Mode Driver Framework, for writing certain classes of driver that can run in user-mode.'
 'Windows Driver Foundation - User-mode Driver Framework Host Process by Microsoft. Remove WUDFHost.exe. This is a Windows system installed file with Windows File Protection (WFP) enabled. Windows Driver Foundation (WDF) is a set of Microsoft tools that aid in the creation of device drivers for Windows.'
 'Sometimes WUDFHost.exe and other EXE system errors can be related to problems in the Windows registry. Several programs can share the same WUDFHost.exe file, but when these programs are uninstalled or changed, sometimes orphaned (invalid) EXE registry entries are left behind.'
 ""I'm using Windows 7 64-bit. I have no idea when this started, but I noticed in Task Manager that a process WUDFHost.exe is constantly using 1GB of my memory. In Process Explorer, I found that it branches off of svchost.exe.""
 'Causes of WUDFHost.exe Errors. WUDFHost.exe problems can be attributed to corrupt or missing files, invalid registry entries associated with WUDFHost.exe, or a virus / malware infection. Corrupt Windows registry keys associated with WUDFHost.exe / Microsoft Windows Vista Promotional Pack.'
 'WUDFHost.exe executes as a process with LOCAL SERVICE privileges typically within the context of its parent svchost.exe (Host Process for Windows Services by Microsoft Corporation). This version is installed on Windows 8 and is compiled as a 32 bit program. More details.'
 ""[SOLVED] WUDFHost.exe Using 1GB of memory. This is a discussion on [SOLVED] WUDFHost.exe Using 1GB of memory within the Windows 7 , Windows Vista Support forums, part of the Tech Support Forum category. I'm using Windows 7 64-bit. I have no idea when this started, but I noticed in Task Manager that a.""
 ""Windows System Restore allows you to go back in time with your PC to help fix your WUDFHost.exe problems. System Restore can return your PC's system files and programs back to a time when everything was working fine.""]",It is a set of Microsoft tools that aid in the creation of device drivers for Windows.
what is an overactive pancreas,"[""An overactive pancrease would produce more enzymes, but in the Islets of Langerhans, it could also produce too much insulin. Too much insulin in the blood could produce Hypoglycemia or low blood sugar.This is sometimes called pre-diabetes.nsulin (and  glucagon) is secreted in the pancreas. Both of these hormones  control your blood sugar level. If it's too high, insulin is  released to put the sugar into the surrounding blood vessel cells,  and vice versa for glucagon.""
 ""Alternate Answer: The pancreas produces digestive enzymes, but it also has Islets of Langerhans that sense the sugar level in the blood coming into the pancrease and produce insulin and the insulin gets into the blood before it goes to the liver.nsulin (and  glucagon) is secreted in the pancreas. Both of these hormones  control your blood sugar level. If it's too high, insulin is  released to put the sugar into the surrounding blood vessel cells,  and vice versa for glucagon.""
 ""Insulin (and  glucagon) is secreted in the pancreas. Both of these hormones  control your blood sugar level. If it's too high, insulin is  released to put the sugar into the surrounding blood vessel cells,  and vice versa for glucagon.nsulin (and  glucagon) is secreted in the pancreas. Both of these hormones  control your blood sugar level. If it's too high, insulin is  released to put the sugar into the surrounding blood vessel cells,  and vice versa for glucagon.""
 'Pancreatitis, or inflammation of the pancreas, is the most common cause of pancreas symptoms. Common causes of pancreatitis include gallstones that form in the nearby gallbladder and travel to the pancreas via the common bile duct; long-term, heavy alcohol use; and certain conditions such as cystic fibrosis.ancreas symptoms may start as pain in the abdomen and around the back. In cases of acute pancreatitis, the pain may intensify and worsen through the course of the day. Seek immediate medical care (call 911) for serious symptoms, such as a swollen and tender abdomen, fever, nausea, rapid pulse, and vomiting.'
 'Pancreas symptoms occur when the pancreas is diseased or has sustained damage or injury. The pancreas is a gland located behind the stomach that plays a key part in the digestive process.The pancreas secretes digestive juices into the small intestine, and these juices break down food.ancreas symptoms may start as pain in the abdomen and around the back. In cases of acute pancreatitis, the pain may intensify and worsen through the course of the day. Seek immediate medical care (call 911) for serious symptoms, such as a swollen and tender abdomen, fever, nausea, rapid pulse, and vomiting.'
 'Pancreatitis, Acute ». The pancreas is a gland located in the upper, posterior abdomen and is responsible for insulin production (endocrine pancreas) and the manufacture and secretion of digestive enzymes (exocrine pancreas) leading to carbohydrate, fat, and protein metabolism.ancreatitis, Acute ». The pancreas is a gland located in the upper, posterior abdomen and is responsible for insulin production (endocrine pancreas) and the manufacture and secretion of digestive enzymes (exocrine pancreas) leading to carbohydrate, fat, and protein metabolism.'
 'Hypoglycemia or low blood sugar is a problem that is much over\xadlooked by many doctors today. It is a condition that usually results from an over active pancreas (too much insulin) and an under active adrenal gland.Let’s explain that a little further: let’s say you ate a candy bar (for example), within a matter of minutes the blood sugar level rises substantially.ypoglycemia or low blood sugar is a problem that is much over\xadlooked by many doctors today. It is a condition that usually results from an over active pancreas (too much insulin) and an under active adrenal gland.'
 'Usages: Pancreas and other glands: Aid for pancreas and other affiliated glands that through malfunction cause high or low blood sugar (namely diabetes or hypoglycemia).sages: Pancreas and other glands: Aid for pancreas and other affiliated glands that through malfunction cause high or low blood sugar (namely diabetes or hypoglycemia).'
 'Pancreatitis is an inflammation of the pancreas that occurs when the digestive juices, called enzymes, attack the gland, damaging the tissues of the pancreas. There are two forms of pancreatitis: acute and chronic.ancreas symptoms may start as pain in the abdomen and around the back. In cases of acute pancreatitis, the pain may intensify and worsen through the course of the day. Seek immediate medical care (call 911) for serious symptoms, such as a swollen and tender abdomen, fever, nausea, rapid pulse, and vomiting.'
 ""The pancreas is a gland that sits behind your stomach in the upper abdomen and helps with digestion. It produces enzymes that are secreted into the small intestine, digesting protein, fat, and carbohydrates. The pancreas also produces insulin to help regulate blood sugar (glucose), the body's main source of energy.he pancreas is a gland that sits behind your stomach in the upper abdomen and helps with digestion. It produces enzymes that are secreted into the small intestine, digesting protein, fat, and carbohydrates. The pancreas also produces insulin to help regulate blood sugar (glucose), the body's main source of energy.""]","An overactive pancrease would produce more enzymes, but in the Islets of Langerhans, it could also produce too much insulin. Too much insulin in the blood could produce Hypoglycemia or low blood sugar.This is sometimes called pre-diabetes."
where is ATP synthase located,"['ATP synthase (EC 3.6.3.14) is an important enzyme that provides energy for the cell to use through the synthesis of adenosine triphosphate (ATP). ATP is the most commonly used energy currency of cells from most organisms.It is formed from adenosine diphosphate (ADP) and inorganic phosphate (P i), and needs energy.The overall reaction sequence is: ADP + P i → ATP, where ADP and P i are joined together by ATP synthase.t is formed from adenosine diphosphate (ADP) and inorganic phosphate (P i), and needs energy. The overall reaction sequence is: ADP + P i → ATP, where ADP and P i are joined together by ATP synthase.'
 ""ATP synthase in plant cells is located in the mitochondria. A  portion is located within the membrane and the other portion is  located above the membrane, inside the mitoch … ondria's matrix.Answered.TP synthase (also known as FoF1-ATP synthase) is a multisubunit integral membrane protein that produce ATP from ADP and Pi using the energy of transmembrane electrochemical p … otential difference of proton (or sodium ion in some cases).""
 'ATP Synthase. Where ATP synthase is located is key to understanding how it produces ATP. Clicking on each of the thumbnail images will bring up a larger, labeled version of the described scene. To see the Flash movie for the following sequence of images, click here.The mitochondria, a key site of ATP synthesis.Its structure is an important aspect of ATP production. ATP synthase and the complexes that form the electron transport chain (ETC) are located throughout the cisternae.Here we see how ATP is oriented in the inner membrane of the mitochondria.here ATP synthase is located is key to understanding how it produces ATP. Clicking on each of the thumbnail images will bring up a larger, labeled version of the described scene. To see the Flash movie for the following sequence of images, click here.'
 'ATP synthase functions by using the energy of the proton gradient established by the electron transport chain to synthesize ATP from ADP and inorganic phosphate. It is compose … d of four major parts, the stator, the rotator, the internal rod, and the catalytic knob.TP synthase binds ADP and a phosphate group together to produce ATP. This happens in the final stage of cellular respiration, which is oxidative phosphorylation.'
 ""ATP synthase in plant cells is located in the mitochondria. A  portion is located within the membrane and the other portion is  located above the membrane, inside the mitoch … ondria's matrix. Answered.In Genetics.TP synthase binds ADP and a phosphate group together to produce ATP. This happens in the final stage of cellular respiration, which is oxidative phosphorylation.""
 'In thylakoids, protons travel through ATP synthase from the stroma to the thylakoid space.Therefore the catalytic knobs of ATP synthase would be located. A) on the side facing the thylakoid space.B) on the ATP molecules themselves. C) on the pigment molecules of PSI and PSII.D) on the stroma side ofthe membrane.n thylakoids, protons travel through ATP synthase from the stroma to the thylakoid space.Therefore the catalytic knobs of ATP synthase would be located. A) on the side facing the thylakoid space.'
 'The same process takes place in the mitochondria, where ATP synthase is located in the inner mitochondrial membrane (so that F 1 -part sticks into mitochondrial matrix, where ATP synthesis takes place).t is formed from adenosine diphosphate (ADP) and inorganic phosphate (P i), and needs energy. The overall reaction sequence is: ADP + P i → ATP, where ADP and P i are joined together by ATP synthase.'
 'The enzyme makes adenosine triphosphate (ATP) from adenosine diiphosphate (ADP) and inorganic phosphate … (Pi).   ADP + Pi ATP   ATP is a universal energy currency of a living cell and is essential for DNA synthesis, muscle contraction, ion and nutrients transport, signal transduction, etc.TP synthase (also known as FoF1-ATP synthase) is a multisubunit integral membrane protein that produce ATP from ADP and Pi using the energy of transmembrane electrochemical p … otential difference of proton (or sodium ion in some cases).'
 'Best Answer: ATP synthase has 2 parts: F0 : in the inner mitochondrial membrane F1 -ATPase in the matrix of the mitochondrion.F1 is the one who catalyzes the hydrolysis of ATP to ADP and Pi.est Answer: ATP synthase has 2 parts: F0 : in the inner mitochondrial membrane F1 -ATPase in the matrix of the mitochondrion.'
 'The electron gradient created by the electron transport chain flows from the inner membrane space to the matrix through the ATP synthase which captures energy from the proton … motive force to create lots of ATP in oxadative phosphorylation.TP synthase binds ADP and a phosphate group together to produce ATP. This happens in the final stage of cellular respiration, which is oxidative phosphorylation.']",In the mitochondria
what kind of bond is created by the attraction between atomic particles of opposite charge?,"['A covalent bond is the force of attraction between the opposite charges of the ions in an ionic compound? No, an ionic bond is when an electron/electrons are taken completely from one atom and moved to another. A covalent bond occurs when there is a sharing of electrons between at…oms.'
 'That is called an ionic bond. Ionic bonds are formed between elements with greater than 1.4 electronegative variance and to a lesser extent by first ionization energy varianc…e, such as alkali metals and nonmetal halogens for example.'
 'exists and is an alternate of . That is called an ionic bond. Ionic bonds are formed between elements with greater than 1.4 electronegative variance and to a lesser extent by first ionization energy variance, such as alkali metals and nonmetal halogens for example.'
 'The type of weak bond formed from the attraction of opposite  charges between hydrogen and other atoms is called a hydrogen bond.  It is a result of electrostatic attraction…. Answered by The WikiAnswers® Community. Making the world better, one answer at a time.'
 'The type of weak bond formed from the attraction of opposite  charges between hydrogen and other atoms is called a hydrogen bond.  It is a result of electrostatic attraction…. Making the world better, one answer at a time.'
 'That is called an <b>ionic bond.</b><br /><br /> Ionic bonds are formed between elements with greater than 1.4 electronegative variance and to a lesser extent by first ionization energy variance, such as alkali metals and nonmetal halogens for example.'
 'A covalent bond is the force of attraction between the opposite charges of the ions in an ionic compound? No, an ionic bond is when an electron/electrons are taken completely from one atom and moved to another. A covalent bond occurs when there is a sharing of electrons between at…oms.'
 'The type of weak bond formed from the attraction of opposite  charges between hydrogen and other atoms is called a hydrogen bond.  It is a result of electrostatic attraction…. Answered by The WikiAnswers® Community. Making the world better, one answer at a time.'
 'The type of weak bond formed from the attraction of opposite  charges between hydrogen and other atoms is called a hydrogen bond.  It is a result of electrostatic attraction…. Making the world better, one answer at a time.'
 'Pure covalent bonding. Atoms [atom: An atom is the smallest part of an element that still has the properties of that element, comprising electrons surrounding a nucleus of protons and neutrons.] in a covalent bond are held together by electrostatic forces of attraction between positively charged nuclei and negatively charged shared electrons.']",Ionic
