question,context,answers
chicago illinois is in what county,"['Start your search by typing in the business name below. Chicago County. YP - The Real Yellow PagesSM - helps you find the right local businesses to meet your specific needs. Search results are sorted by a combination of factors to give you a set of choices in response to your search criteria.'
 '2700 S. California Avenue. Chicago, Illinois 60608. ———————————————————————–. The Cook County Department of Corrections is situated on 96 acres, and is known as the largest county pre-detention jail facility in the U.S. This facility primarily holds pre-trial offenders.'
 'Cook County is a county in the U.S. state of Illinois. It is the second-most populous county in the United States after Los Angeles County, California. As of 2015, the population was 5,238,216. Its county seat is Chicago, the largest city in Illinois and third-most populous city in the United States. More than 40% of all residents of Illinois live in Cook County.'
 'County & Parish Government. 1  From Business: The Office of the State Appellate Defender is a state agency that represents indigent persons on appeal in criminal cases when appointed by the Illinois Supreme C….'
 ""Cook County Clerk's Office. The Cook County Clerk manages Suburban Cook County elections. The Clerk's Office also oversees the countywide systems for birth, death and marriage certificates for all of Cook County, including Chicago. The Clerk's Office also manages Economic Disclosure and campaign finance report filing for all of Cook County.""
 ""Tax Bills and Payments. The Cook County Treasurer’s Office mails out tax bills and collects payments. For a copy of your bill and/or payment information, please contact the Cook County Treasurer's Office at 312-443-5100, or visit their Web site at http://www.cookcountytreasurer.com/.""
 'Cook County Department of Corrections / Cook County Jail. The Cook County Department of Corrections is situated on 96 acres, and is known as the largest county pre-detention jail facility in the U.S. This facility primarily holds pre-trial offenders.'
 ""Boundary Changes. 1  15 January 1831: Cook County was created from Putnam County by an act of the Illinois State Legislature as the 54th county established in Illinois. The unincorporated Fort Dearborn settlement at the mouth of the Chicago River became the new county's seat.""
 'The map above is a Landsat satellite image of Illinois with County boundaries superimposed. We have a more detailed satellite image of Illinois without County boundaries. Copyright information: The maps on this page were composed by Brad Cole of Geology.com.'
 'The records for Chicago and Cook County are available for as early as 1871. Earlier records were destroyed by Chicago fire of October 8, 1871. Many Cook County, Illinois births, marriages, and deaths indexes and images are now available online:']",Cook
is canola oil unhealthy,"[""Poisonous Foods!! What the major Health Food Stores are not telling you about the safety of their health foods. The Dangers Of Using Canola Oil Recently I bought a cooking oil that's new to our Health Food Stores and Supermarkets, Canola Oil. I tried it because the label assured me it was lowest in bad fats.""
 ""Here's how olive oil and canola oil compare. Olive Oil and Canola Oil are Manufactured Differently. Olive oil is made from olives, the fruit of the olive tree, and is considered a fruit oil. Ripe olives are crushed, then pressed; the collected juices constitute olive oil.""
 'Misinformation about canola oil may stem from the fact that the canola plant was developed through crossbreeding with the rapeseed plant. Rapeseed oil contains very high levels of erucic acid, a compound that in large amounts can be toxic to humans. Canola oil, however, contains very low levels of erucic acid. Canola oil is also low in saturated fat and has a high proportion of monounsaturated fat, which makes it a healthy and safe choice when it comes to cooking oils. With. Katherine Zeratsky, R.D., L.D. 1  Butter vs. margarine. 2  Detox diets.'
 ""Don't be fooled......Canola Oil is in everything!!! Always read the ingredients of every product you buy, anywhere!!! Even in the Health Food Stores, Canola Oil is widely used in their products.""
 ""While olive oil is considered the healthier oil, it's sometimes appropriate to choose canola oil instead. Extra virgin and virgin olive oils retain much of the flavor of the olives from which they're pressed, so while they might make a tasty dip or dressing, they often aren't appropriate for cooking or baking.""
 'Yet, studies involving olive oil, a monounsaturated oil, point to positive health benefits and disease prevention. Being that Canola oil is a monounsaturated oil, this may make Canola oil superior to other polyunsaturated oils such as sunflower, corn, and safflower oil. Canola oil is, for the most part, tasteless, -- making it a good choice for baked goods. The bad: Canola oil took the market by storm, as it is relatively inexpensive to produce, especially compared to olive oil. Olive oil has a long history of scientifically documented health benefits.'
 ""I've read that canola oil contains toxins. Health concerns about canola oil are unfounded. Canola oil, which is extracted from the seeds of the canola plant, is generally recognized as safe by the Food and Drug Administration.""
 ""I said, I'll bet anything that you are using Canola oil. Sure enough, there was a big gallon jug in the pantry.Rape seed oil is a penetrating oil, to be used in light industry, not for human consumption.""
 'In addition, olive oil is too expensive to use in most processed foods. Canola oil has filled this need for a mass-produced, publicly acceptable form of a monounsaturated oil. Olive oil is the gold standard, documented with extensive research.'
 'Compiled by Darleen Bradley.Canola oil is a health hazard to use as a cooking oil or salad oil. It is not the healthy oil we thought it was. It is not fit for human consumption, do not eat canola oil, it can hurt you. Polyunsaturated or not, this is a bad oil.']",No
how many game of thrones books are there,"['The first book of the series is titled A Game of Thrones, and the first season of the television show follows its plot. A Clash of Kings, A Storm of Swords, A Feast for Crows and A Dance with Dragons are the other four novels in print as of August 2014.'
 ""George RR Martin's editor hints at eighth Game of Thrones book. Martin's editor Anne Groell has said in a Q&A that the presence of an eighth kingdom in Martin's A Song of Ice and Fire saga might indicate an eighth book in the series. This article is 2 years old. Ben Beaumont-Thomas.""
 'Trying to rectify this with the schedule of HBO’s Game of Thrones, which needs its own timetable explanation. Season 1 (2011) – Book 1. Season 2 (2012) – Book 2. Season 3 (2013) – Book 3, Part 1. Season 4 (2014) – Book 3, Part 2, few elements from Books 4 and 5.'
 ""Tuesday 3 June 2014 05.49 EDT First published on Tuesday 3 June 2014 05.49 EDT. Anne Groell, the editor of George RR Martin's epic book saga A Song of Ice and Fire which is being filmed for TV as Game of Thrones, has suggested that the series might end up with eight novels rather than the planned seven.""
 'In its initial conception, Mr. Martin supposed it would be a trilogy, but part way through A Game of Thrones he decided it’d have to be four books. While working on A Clash of Kings, he came to realize that the story would require at least six novels, and for a long time he stuck to this.'
 'To date, these have been the release years of the books in the Ice and Fire series: A Game of Thrones (1996) A Clash of Kings (1998) A Storm of Swords (2000) A Feast for Crows (2005) A Dance with Dragons (2011) As you can see, once upon a time, George RR Martin was able to get out new books every two years for a while.'
 ""Westeros.org is the premiere fansite for George R.R. Martin's A Song of Ice and Fire. Discuss the series on the forums and browse the fan-edited wiki. Read all about HBO's Game of Thrones, learn more about the books from our resource collections and play the MUSH.""
 'According to GRRM’s official website, official titles for the books are: A Game of Thrones, A Clash of Kings, A Storm of Swords, A Feast for Crows, A Dance with Dragons, The Winds of Winter (forthcoming) and A Dream of Spring (forthcoming).'
 ""Quick Answer. As of August 2014, there are five books in George R. R. Martin's A Song of Fire and Ice, the book series on which the Game of Thrones television series is based. Martin has said that he plans to write seven books in total.""
 'There are currently five books published in the A Song of Ice and Fire series, which may also be called the Game of Thrones series after the television adaptation. There are plans for a further two novels in the series. The following list is the titles of the five published and two planned books in the series. 1.']",Five books.
the iran-contra,"['The background to the scandal lay in President Ronald Reagan’s pre-occupation with the spread of communism, in particular in the United States’ own backyard of Central America.'
 'DOCUMENTS MEDIA PRESS PROFILES TIMELINES. Welcome to “Understanding the Iran-Contra Affairs,” the only comprehensive website on the famous Reagan-era government scandal, which stemmed from the U.S. government’s policies toward two seemingly unrelated countries, Nicaragua and Iran.'
 'NOV. 23 Colonel North meets privately with Mr. McFarlane and tells him that the diversion was approved by White House superiors. The colonel also meets with Attorney General Edwin Meese 3d and informs him. NOV. 24 Mr. Meese tells the President of the diversion. NOV. 25 Mr. Meese discloses the Iran-contra connection.'
 ""The Iran-Contra Affair. Ronald Reagan's efforts to eradicate Communism spanned the globe, but the insurgent Contras' cause in Nicaragua was particularly dear to him. Under the so-called Reagan Doctrine, the CIA trained and assisted this and other anti-Communist insurgencies worldwide.""
 'Iran-Contra Affair, 1980s U.S. political scandal in which the National Security Council (NSC) became involved in secret weapons transactions and other activities that either were prohibited by the U.S. Congress or violated the stated public policy of the government.'
 'User Reviews. Cover Up: This documentary was covered up, unreported by mainstream media. I worked for the Jackson campaign in 1988, when this documentary was shown in only one small theater in the large US city where I live. During that campaign, the press would print any rumor about any candidate, no matter how lacking in credibility the source.'
 '“Understanding the Iran-Contra Affairs” provides information about the rise of the contra rebels in Nicaragua and about the Iranian Revolution, as well as the U.S. responses to both. Moreover, the website details the media’s discovery and later press coverage of the Affairs, and the subsequent televised congressional hearings.'
 'The Cold War Museum. Iran Contra Affair (1983 - 1988) The Iran Contra Affair began as an internal U.S. confrontation between Ronald Reagan and the Democratic Congress. In 1984, the Boland Amendment passed, which said that the CIA and Department of Defense could not give militaristic aid (specifically in Nicaragua).'
 'The Iran-Contra Report: Chronology. 1981 AUG. 4 Oliver L. North, a Marine major, is assigned to the National Security Council at the White House. DECEMBER President Ronald Reagan signs an executive order that authorizes a covert operation by the C.I.A. to support the contras, rebels who are fighting the leftist Government of Nicaragua.'
 ""The Iran-Contra Affair. Ronald Reagan's efforts to eradicate Communism spanned the globe, but the insurgent Contras' cause in Nicaragua was particularly dear to him. Battling the Cuban-backed Sandinistas, the Contras were, according to Reagan, the moral equivalent of our Founding Fathers..""]",The Iran Contra Affair began as an internal U.S. confrontation between Ronald Reagan and the Democratic Congress.
what was the inqisitions all about,"['the Inquisition: an organization in the Roman Catholic Church in the past that was responsible for finding and punishing people who did not accept its beliefs and practices. : a harsh and unfair investigation or series of questions.'
 'Tweet. the Inquisition: an organization in the Roman Catholic Church in the past that was responsible for finding and punishing people who did not accept its beliefs and practices. : a harsh and unfair investigation or series of questions.'
 'The Spanish Inquisition was established in 1478 as a court for the detection of heretics, although its true purpose remains somewhat obscure. While most historians point to a combination of political, economic and religious motives, the latter were certainly predominant.'
 'Sooner or later, any discussion of apologetics with Fundamentalists will address the Inquisition. To non-Catholics it is a scandal; to Catholics, an embarrassment; to both, a confusion. It is a handy stick for Catholic-bashing, simply because most Catholics seem at a loss for a sensible reply.'
 'While many people associate the Inquisition with Spain and Portugal, it was actually instituted by Pope Innocent III (1198-1216) in Rome. A later pope, Pope Gregory IX established the Inquisition, in 1233, to combat the heresy of the Abilgenses, a religious sect in France.'
 'noun in·qui·si·tion \\ˌin-kwə-ˈzi-shən, ˌiŋ-\\. Tweet. the Inquisition: an organization in the Roman Catholic Church in the past that was responsible for finding and punishing people who did not accept its beliefs and practices.'
 ""According to public news reports the book's editor, Prof. Agostino Borromeo, stated that about 125,000 persons were investigated by the Spanish Inquisition, of which 1.8% were executed (2,250 people). Most of these deaths occurred in the first decade and a half of the Inquisition's 350 year history.""
 'The first was established in 1184 in southern France as a response to the Catharist heresy. This was known as the Medieval Inquisition, and it was phased out as Catharism disappeared. Quite separate was the Roman Inquisition, begun in 1542. It was the least active and most benign of the three variations.'
 'It was different from other court systems because the court actually took part in the process of trying the accused. The term inquisition has a third meaning also -- the trials themselves. Because of its association with torture and execution, inquisition remains a controversial and difficult subject.'
 'This is as much a disservice to the truth as an exaggeration of the Inquisition’s bad points. These well-intentioned, but misguided, apologists are, in one respect, much like Lea, Coulton, and contemporary Fundamentalist writers.']",An organization in the Roman Catholic Church in the past that was responsible for finding and punishing people who did not accept its beliefs and practices.
what is a requirement traceability matrix,"['A requirements traceability matrix may be used to check to see if the current project requirements are being met, and to help in the creation of a request for proposal, software requirements specification, various deliverable documents, and project plan tasks. requirements traceability matrix may be used to check to see if the current project requirements are being met, and to help in the creation of a request for proposal, software requirements specification, various deliverable documents, and project plan tasks.'
 ""A traceability matrix is a document that co-relates any two-baseline documents that require a many-to-many relationship to check the completeness of the relationship. It is used to track the requirements and to check the current project requirements are met.ow to create Requirement Traceability Matrix. Let's understand the concept of Requirement Traceability Matrix through a Guru99 banking project. On the basis of Business Requirement Document (BRD) and Technical Requirement Document (TRD), testers start writing test cases.""
 'Requirements Traceability Matrix. The Requirements Traceability Matrix (RTM) is a document that links requirements throughout the validation process. The purpose of the Requirements Traceability Matrix is to ensure that all requirements defined for a system are tested in the test protocols.he traceability matrix is a tool both for the validation team, to ensure that requirements are not lost during the validation project, and for auditors, to review the validation documentation.'
 'Requirements traceability is a sub-discipline of requirements management within software development and systems engineering. Requirements traceability is concerned with documenting the life of a requirement and providing bi-directional traceability between various associated requirements.It enables users to find the origin of each requirement and track every change that was made to this requirement.equirements traceability is concerned with documenting the life of a requirement and providing bi-directional traceability between various associated requirements.'
 ""Requirement Traceability Matrix. Requirement Traceability Matrix or RTM captures all requirements proposed by the client or development team and their traceability in a single document delivered at the conclusion of the life-cycle.In other words, it is a document that maps and traces user requirement with test cases.The main purpose of Requirement Traceability Matrix is to see that all test cases are covered so that no functionality should miss while testing.ow to create Requirement Traceability Matrix. Let's understand the concept of Requirement Traceability Matrix through a Guru99 banking project. On the basis of Business Requirement Document (BRD) and Technical Requirement Document (TRD), testers start writing test cases.""
 'Requirements traceability matrix is a table that shows the many to many relationship between requirements and test cases. Each requirement is mapped to one or more test cases.Each test tests one or more requirements.This video explains the Requirements traceability matrix or RTM.equirements traceability matrix is a table that shows the many to many relationship between requirements and test cases. Each requirement is mapped to one or more test cases.'
 'A traceability matrix is a table that traces a requirement to the tests that are needed to verify that the requirement is fulfilled. A good traceability matrix will provide backward and forward traceability, i.e. a requirement can be traced to a test and a test to a requirements.f a test fails, it is possible to use the traceability matrix to see what requirements and code the test case relates to.The goal of a matrix of this type is -1. To make sure that the approved requirements are addressed/covered in all phases of development: From SRS to Development to Testing to Delivery.2.'
 'Traceability matrices can be established using a variety of tools including requirements management software, databases, spreadsheets, or even with tables or hyperlinks in a word processor. A traceability matrix is created by associating requirements with the work products that satisfy them.Tests are associated with the requirements on which they are based and the product to be tested against the requirement. traceability matrix is created by associating requirements with the work products that satisfy them. Tests are associated with the requirements on which they are based and the product to be tested against the requirement.'
 'A traceability matrix is used to verify that all stated and derived requirements are allocated to system components and other deliverables (forward trace). The matrix is also used to determine the source of requirements (backward trace).Requirements traceability includes tracing to things other than software that satisfy the requirements such as capabilities, design elements, manual operations, tests, etc.EQUIREMENTS TRACEABILITY MATRIX. The purpose of the RTM is to help ensure the object of the requirements conforms to the requirements by associating each requirement with the object via the traceability matrix.'
 'The traceability matrix can either reference the requirement identifiers (unique numbers for each requirement) or the actual requirement itself. In the example shown below, requirements are traced between a Functional Requirements Specification, Design Specification, and Operational Qualification.he traceability matrix is a tool both for the validation team, to ensure that requirements are not lost during the validation project, and for auditors, to review the validation documentation.']",It is a document that links requirements throughout the validation process.
which birth control method reduces the risk of pregnancy and protects from sexually transmitted infections?,"['– Ellie*. It’s great that you are thinking about protection in advance. After abstinence, the best protection against both pregnancy and STDs is actually to use two methods of birth control at the same time: a condom to protect against STDs, and.'
 'Which birth control methods also protect against sexually transmitted infections (STIs)? The male latex or polyurethane condom gives the best protection against STIs. The female condom provides some protection. With all other methods, you also should use a male or female condom to protect against STIs.'
 'Birth control pills, injections, patches or intravaginal rings only protect against pregnancy. There were some previous studies that suggested that the environment in the cervical mucous changed with the birth control pill that would ward off sexually transmitted infections such as gonorrhea and chlamydia.'
 ""Condoms are the only type of birth control that protects against STDs. When used correctly, condoms are also fairly effective at protecting against pregnancy — but they're not as successful as hormonal methods like the Pill, patch, ring, IUD, or birth control shot.""
 'Other things to consider when choosing a method of birth control include: 1  Health benefits, such as decreased risk of sexually transmitted infections with condoms and reduced risk of ovarian cancer and uterine cancer with use of birth control pills for one year or longer. 2  Convenience and ease of use. 3  Cost.'
 'If you have sex without using any birth control, if the birth control method did not work (for instance, the condom broke during sex), or if you are raped, you can use emergency birth control to prevent pregnancy. Emergency birth control is available in pill form or as a copper IUD.'
 'After abstinence, the best protection against both pregnancy and STDs is actually to use two methods of birth control at the same time: 1  a condom to protect against STDs, and. 2  a hormonal method (like the Pill), because these have the highest protection rates against pregnancy.'
 'No. Most birth control methods—such as the pill, Norplant, the diaphragm, and the intrauterine device (IUD)—do not protect against sexually transmitted infections (STIs).'
 'To choose the right birth control method for you, consider the following: 1  How well it prevents pregnancy. 2  How easy it is to use. 3  Whether you need a prescription to get it.  Whether it protects against sexually transmitted infections 1  (STIs) Whether you have any health problems.'
 'No. Despite the many non-contraceptive benefits of birth control pills, they will not protect someone from sexually transmitted diseases. Only a barrier method such as a condom (male or female) will limit the risk of most STDs.']",The male latex or polyurethane condom and female condom.
