question,context,answers
what degree do you have to get to a engineer,"[""Master's degrees prepare students for careers in industry that don't have a research focus, says Babatunde Ogunnaike, dean of the college of engineering at the University of Delaware. If you want to work in research either in industry or in academia or for a government research lab, you need to get a Ph.D., he says.""
 'For example, a civil engineer with a bachelor’s degree may be expected to do a variety of day-to-day tasks, but a civil engineering major with a master’s who specialized in structures will have opportunities to work on structural-specific projects..'
 ""A degree with some form of the word engineer or engineering in the title is not necessarily an engineer's degree. Particularly, a Master of Engineering (M.Eng.) or Bachelor of Engineering (B.Eng.) degree is not an Engineer's degree, nor is any other bachelor's, master's, or doctoral degree. Rather, the engineer's degree is in a category of its own.""
 ""As of year 2012 in Russia, following degrees correspond to the engineer's degree in the sense of this article: 1  инженер - engineer, which was formerly awarded after 4, 5, 6 years of study, may also contain clarification on the nature of engineering field, such as mining engineer or systems engineer.""
 ""In Europe, the engineer degree is ranked at the same academic level as a bachelor's degree or master's degree, and is often known literally as an engineer diploma (abbreviated Dipl.-Ing. or DI).""
 ""Eddie Machek, who is earning a master's degree in civil engineering from the University of Akron and who will start a doctoral program in engineering at Georgia Tech this fall, explains the difference between the degrees this way: At a bachelor's level you are going to go out and do what's been done.""
 ""In the United States, the engineer's degree is at a more advanced level than a standard U.S. master's degree, may include a graduate thesis, but lacks the doctoral dissertation component of doctorates such as the PhD.""
 ""Students looking to get a graduate degree in engineering can choose between a master's program and a Ph.D. It's a big decision, experts say, and one that can significantly affect a student's career. [Learn why engineers may be more likely to get hired.""
 ""Engineer's degree. An engineer's degree is an advanced academic degree in engineering that is conferred in Europe, some countries of Latin America, and a few institutions in the United States.""
 ""And the Engineer's degree is named The Degree of Engineer in the degree(e.g The Degree of Engineer in Information Technology). The degree of engineer is ranked at the same academic level as a bachelor's degree or master's degree, and is often known literally as an engineer diploma (abbreviated Dipl.-Ing. or DI).""]","An engineer's degree is an advanced academic degree in engineering that is conferred in Europe, some countries of Latin America, and a few institutions in the United States."
what year was the xbox released,"['Release date: 2015. Time manipulation is nothing new in games. We’ve dodged more than our fair share of gunfire in Bullettime and used magic sand to turn back time on more than one occasion, but SUPERHOT’s take on the matter is something else entirely.'
 'Release date: 2015. Gunscape coming to Xbox One is a massive undertaking. Not because the system can’t handle it, but because what Gunscape allows us to do with our first-person shooters is unlike anything the Xbox has seen before.'
 'Everything New Is Old Again. Given the four years between the release of the first Xbox and the arrival of its successor, it’s no surprise that after six years rumors began circulating in March 2011 that the 360 was on its way out and Microsoft was already hard at work on its next console.'
 '[1]. The release date for other regions will be announced in the future, with the Japanese release expected in late 2014. [2]. 1  North American Xbox One Release Date: November 22, 2013. 2  European Xbox One Release Date: November 22, 2013.'
 ""Halo 5: Guardians is coming to the Xbox One. We know, stop the presses for the shock of the century. Master Chief's arrival to the next generation is little surprise, but we're still a bit unclear what exactly this game is about.""
 'Edit Page Last Edit: 1 year 10 months ago. The Xbox One will be available on November 22, 2013 in 13 territories. The full list of territories that will be getting the console on this date consists of Australia, Austria, Brazil, Canada, France, Germany, Ireland, Italy, Mexico, New Zealand, Spain, UK, and the USA. [1].'
 'He was released in 1991 and he is alive and well now and his name is Jasmine hurt and he is the world xbox 360 pro and nobody can beat him and if you think you can go ah … ead and try to or try me aka jazz. Bayley Dole.'
 'The original Xbox video game console came out on November 15, 2001. Production ended in August 2005, so that the Xbox 360 could be released in November 2005.'
 ""Microsoft is dishing out the exclusives this year. A new Halo is on the horizon and there are some interesting looking indies taking the spotlight. On top of that, we got a bunch of announcement revealing some of our most anticipated games, and they're coming in the near future. This year looks to hold some of the best Xbox One games we've seen hit the console yet.""
 'There is not a release date for Little Big Planet on Xbox 360 now because they have not made one for Xbox 360 yet because there not making little big planet for xbox 360. 9 people found this useful.']",2001
where is the deepest body of ocean,"[""Measuring the Greatest Ocean Depth. The Challenger Deep in the Mariana Trench is the deepest known point in Earth's oceans. In 2010 the United States Center for Coastal & Ocean Mapping measured the depth of the Challenger Deep at 10,994 meters (36,070 feet) below sea level with an estimated vertical accuracy of ± 40 meters.""
 'What a fascinating question! The following are the top 10 deepest bodies of water in the world in order from greatest to least: Pacific Ocean (35,827 ft) (10,924 meters) Atlantic Ocean (30,246 ft) (9,219 meters) Indian Ocean (24,460 ft) (7,455 meters) Caribbean Sea (22,788 ft) (6,946 meters)'
 ""The Challenger Deep in the Mariana Trench is the deepest known location in Earth's oceans. 1  Mariana Trench map: Map showing the geographic location of the Mariana Trench in the Pacific Ocean. 2  Challenger Deep map: Map showing the location of the Challenger Deep on the southern end of the Mariana Trench, south of Guam.""
 'Best Answer: What a fascinating question! The following are the top 10 deepest bodies of water in the world in order from greatest to least: Pacific Ocean (35,827 ft) (10,924 meters) Atlantic Ocean (30,246 ft) (9,219 meters) Indian Ocean (24,460 ft) (7,455 meters)'
 'That means, while they were parked on the bottom in the bathyscaphe, there were almost seven miles/11km of water over their heads! If you cut Mount Everest off at sea level and put it on the ocean bottom in the Challenger Deep, there would still be over a mile of water over the top of it! Hydrostatic Pressure.'
 'If you cut Mount Everest off at sea level and put it on the ocean bottom in the Challenger Deep, there would still be over a mile of water over the top of it! When you get into the ocean (or any body of water) and you start diving down from the surface, the deeper you dive the more water is over the top of you.'
 'Beneath the surface of the Pacific Ocean to the southeast of Japan, there is a very deep, crescent-shaped trench called the “Mariana Trench.. Near the southern tip of the crescent, there is a small slot-shaped area called the “Challenger Deep..'
 'The Challenger Deep is named after a British Royal Navy ship called the HMS Challenger. The Challenger was the first ship to measure the depths of what is now known as the Challenger Deep. The trench was measured by “sounding, which involves dropping a very long line with a weight at the end into a body of water.'
 'The more gallons of water you put between you and the surface of the ocean, the greater the pressure is on your body because of the weight of the water over the top of you. This pressure is called hydrostatic pressure. Dive to the. Challenger Deep.'
 ""Clouds over the Atlantic Ocean. An ocean (from Ancient Greek ὠκεανός, transc. Okeanós, the sea of classical antiquity) is a body of saline water that composes much of a planet's hydrosphere. On Earth, an ocean is one of the major conventional divisions of the World Ocean, which covers almost 71% of its surface.""]",Mariana Trench
which is better for you aspirin or ibuprofen,"['Acetaminophen or aspirin is generally a better first option for those with heart problems, such as heart disease, uncontrolled high blood pressure, or previous heart attack or stroke. Skip acetaminophen if you regularly drink three or more alcoholic drinks per day; the combination increases the risk of liver damage.'
 ""Aspirin, sold as Bayer or Bufferin, is absorbed into the bloodstream and essentially looks for areas where we feel pain. Aspirin is used to treat headaches of all sizes, to suppress minor body aches and pains, and to reduce inflammation when we're sore.""
 ""When should you take ibuprofen? Ibuprofen can be used to relieve pain and inflammation caused by rheumatic and muscular pain, headaches, backache, and period pain. It can also be used to relieve cold and 'flu-like' symptoms.""
 ""But it's rough on the upper digestive tract (can cause upset stomach, heartburn, and even dyspepsia), it's bad for hemophiliacs, and it's not safe for kids. Ibuprofen, sold as Motrin or Advil, is chemically similar to regular aspirin and functions in a similar way. In lower doses, ibuprofen seems to irritate the esophagus and stomach lining less than aspirin and naproxen. If you have ulcers or acid reflux disease, ibuprofen may be the best product for pain clearly resulting from inflammation (arthritis, sprains, sunburns, etc.). More from Greenfield Patch.""
 'Take acetaminophen, which is less likely to cause bleeding. Also, skip NSAIDs (except for aspirin—see below) if you have heart problems or high blood pressure because they can increase your risk of heart attack and stroke.'
 'For most minor ailments, an over-the-counter drug may be all you need. Acetaminophen (Tylenol and generic), aspirin, ibuprofen (Advil, Motrin, and generic), and naproxen (Aleve and generic) are all inexpensive.'
 'Aspirin and ibuprofen both belong to a class of medications known as the non steroidal anti inflammatory medications (NSAIDs). All NSAIDs have good anti inflammatory and anti pain effects, so both aspirin and ibuprofen will be effective in relieving pain and inflammation in your back. The main difference between aspirin and ibuprofen has to do with their side effects and other usages. In particular, aspirin is a blood thinner (which is actually its most common usage) whereas ibuprofen is not.'
 ""Don't take acetaminophen for a hangover because it can cause liver damage, especially when mixed with alcohol. Instead, to calm a headache that comes the morning after drinking too much alcohol, take aspirin or ibuprofen. But make sure you eat something first so that you don't irritate your stomach lining.""
 'Taking low-dose aspirin (81 milligrams or baby aspirin) can help ward off stroke for some women 65 and older and heart attack for men 45 to 79. But if you take aspirin, skip ibuprofen for pain relief.'
 'When should you take aspirin? Aspirin can be used to relieve pain and inflammation caused by rheumatic and muscular pain, sprains, backache, headache, sore throat, toothache and period pain. It can also be used to treat flu-like symptoms and reduce fever in adults. In low doses, it can be used to thin the blood.']",Aspirin
what is the difference between conductivity and resistivity,"['Popular Answers. 1  Yes, there is a relation between the pH and the electrical current flow [the conductivity] of a solution, but there are other factors that affect the conductivity. This topic, the conductivity of solutions, takes up a full chapter in a textbook on physical chemistry with many graphs and numerical tables.'
 'Thermal conductance is the time rate of steady state heat flow through a unit area of a material or construction induced by a unit temperature difference between the body surfaces, in W/m2⋅K. C-value, hence, is the reciprocal of the R-value and can be expressed as Equation (3).'
 ""Resistivity and conductivity are reciprocals: ρ = 1 / σ {\\displaystyle \\rho =1/\\sigma } . Resistivity is a measure of the material's ability to oppose electric current. This formula is not exact, as it assumes the current density is totally uniform in the conductor, which is not always true in practical situations.""
 'R-value – Thermal Resistance. Thermal resistance is the temperature difference, at steady state, between two defined surfaces of a material or construction that induces a unit heat flow rate through a unit area, K⋅m2/W. According to this definition and Equation 1, Equation 2, therefore, can be obtained.'
 'The higher the conductance the better the component is at conducting. Conductance is just the inverse of resistance. The symbol for conductance is G (heaven knows why) and the unit of conductance is the siemens, S, named after the 19th century German engineer and industrialist Ernst Werner von Siemens. It used to be called the mho, which is just ohm written backwards.'
 'up vote 3 down vote accepted. Conductance is the extrinsic property while conductivity is the intrinsic property. This means that conductance is the property of an object dependent of its amount/mass or physical shape and size, while conductivity is the inherent property of the material that makes up the object.'
 ""The unit of conductivity is the siemens per metre (see below). Again it's a material property rather than a component property. So you talk about the conductivity of copper but the conductance of this piece of copper wire. A piece of wire has a high conductance if it's short and fat.""
 'The SI unit of electrical resistance is the ohm (ω), while electrical conductance is measured in siemens (S). An object of uniform cross section has a resistance proportional to its resistivity and length and inversely proportional to its cross-sectional area.'
 'The electrical resistance of an electrical conductor is a measure of the difficulty to pass an electric current through that conductor. The inverse quantity is electrical conductance, and is the ease with which an electric current passes. Electrical resistance shares some conceptual parallels with the notion of mechanical friction.'
 '1 Answer 1. Conductance is the extrinsic property while conductivity is the intrinsic property. This means that conductance is the property of an object dependent of its amount/mass or physical shape and size, while conductivity is the inherent property of the material that makes up the object.']","Conductivity is the electrical current flow, while resistivity is a measure of the material's ability to oppose electric current."
how soon can nausea start in pregnancy,"['Nausea can begin as early as the second week of your pregnancy. Most of the time, nausea does not start until between the fourth and sixth weeks of pregnancy. This will typically be between five and seven weeks after the end of the last menstrual period.'
 ""Morning sickness is considered the first symptom of pregnancy and generally starts during the first trimester. For most women, morning sickness symptoms Learn about the symptoms of morning sickness. can start as early as the 3rd week of pregnancy, but it's more common between the 5th-8th week of pregnancy.""
 'For most women, morning sickness starts about the sixth week of pregnancy, which is about three weeks after conception, assuming you have a normal menstrual cycle. It can start as early as the fourth week, which is right around when you might get your period.'
 'Once you have a confirmed pregnancy, the morning sickness usually starts around the first 4 to 6 weeks of pregnancy and it tends to get worse over the next month or so after it begins. However, for some women, the queasiness begins as early as two weeks after conception.'
 ""For most women, morning sickness symptoms Learn about the symptoms of morning sickness. can start as early as the 3rd week of pregnancy, but it's more common between the 5th-8th week of pregnancy.""
 'Nausea is one of the earliest signs of pregnancy. While breast tenderness is often the first noticeable sign of pregnancy, nausea usually starts quickly after that. Nausea can begin as early as the second week of your pregnancy.'
 'Morning sickness usually starts around week six of your pregnancy. But because every pregnancy is different, this can vary from woman to woman. If you have morning sickness, you may feel queasy when you wake up. But although it is called morning sickness, nausea can strike at any time of the day or night.'
 'When to Expect Morning Sickness. For most women, morning sickness starts about the sixth week of pregnancy, which is about three weeks after conception, assuming you have a normal menstrual cycle. It can start as early as the fourth week, which is right around when you might get your period.'
 'Nausea caused by pregnancy, sometimes called “morning sickness,” is a fairly common symptom of pregnancy. Around 70% of all new moms-to-be will experience morning sickness. Morning sickness can occur at any time of the day, not just during the morning.'
 'While breast tenderness is often the first noticeable sign of pregnancy, nausea usually starts quickly after that. Nausea can begin as early as the second week of your pregnancy. Most of the time, nausea does not start until between the fourth and sixth weeks of pregnancy.']",As early as the second week of your pregnancy.
what is a nata,"['WELCOME TO NATA. NATA is the authority that provides independent assurance of technical competence through. a proven network of best practice industry experts for customers who require confidence. in the delivery of their products and services. NATA provides assessment, accreditation.'
 'Landline : 0422 - 4348809. The National Aptitude Test in Architecture NATA ENTRANCE EXAM is a National level examination for admission to undergraduate courses in Bachelor of Architecture i.e. (B.Arch).'
 'NATA is more like an eligibility test for admission into the Architecture Course. Yes it is a compulsory test as the scores are accepted by maximum colleges. The National Aptitude Test in Architecture is a national level examination for admission to undergraduate courses in Architecture.'
 '1. National Aptitude Test in Architecture (NATA) is being conducted by the Council of Architecture at national level for admission to 5 year B.Arch Degree Course at all recognized institutions across India. 2. NATA scores are used by admissions authorities of different Government, Govt.'
 'The association of Balder with corn suggests that, like nata of the Nahua tribes, he was a harvest spirit, among other things. Myths of Babylonia and Assyria Donald A. Mackenzie. You must let us see what it is, said nata, with his good-natured laugh. The Usurper Judith Gautier.'
 'The association of Balder with corn suggests that, like nata of the Nahua tribes, he was a harvest spirit, among other things. You must let us see what it is, said nata, with his good-natured laugh. I have taken out the nails all round a plank as long as our boat, and as broad as nata is from shoulder to shoulder.'
 'The National Aptitude Test in Architecture (NATA) measures the aptitude of the student for specific field of study, i.e. Page on gbrionline.org. Minimum Marks (Cut Off) for National Aptitude Test in Architecture (NATA): Applicant should have score 40% or more marks in entrance exam to be declared qualify.'
 'The Council of Architecture (COA) conducts National Aptitude Test in Architecture ( NATA ) entrance exam to measure the aptitude of the applicant for admission to First year of five year B.Arch Degree at all recognized institutions all over India.'
 'Traditional Nata. One of the best things to come from raw milk is nata. Nata is the cream that thickens and congeals from boiling raw milk. It’s naturally sweet, creamy, silky, and tastes absolutely fabulous dolloped on top of toasted homemade, European style bread. Today, many people that drink raw milk are under the assumption that its a traditional practice.'
 'National Aptitude Test in Architecture. NATA Logo. The National Aptitude Test in Architecture (NATA), is conducted by National Institute of Advanced Studies in Architecture (NIASA) which is a body of Council of Architecture, New Delhi in India.']",It is the authority that provides independent assurance of technical competence through a proven network of best practice industry experts for customers who require confidence.
what is a palliative consult,"['For the journal, see Palliative Medicine (journal). Palliative care is a multidisciplinary approach to specialized medical care for people with life-limiting illnesses. It focuses on providing people with relief from the symptoms, pain, physical stress, and mental stress of the terminal diagnosis.'
 'A. Palliative medicine is a medical subspecialty provided by doctors who offer palliative care for people who are seriously ill. Palliative care relieves suffering and improves quality of life for people of any age and at any stage in a serious illness, whether that illness is curable, chronic, or life-threatening.'
 'What is Palliative Care? Pathways’ Palliative Care Program is a specialized service providing pain and symptom management, counseling, support and guidance in navigating health care options and choices. This is not hospice care; it is an entirely different option for those dealing with serious illness.'
 'Palliative Care. The differences between hospice and palliative care. Hospice care and palliative care are very similar when it comes to the most important issue for dying people: care. Most people have heard of hospice care and have a general idea of what services hospice provides.'
 ""Q. What's the difference between palliative care and hospice care? A. Palliative care is whole-person care that relieves symptoms of a disease or disorder, whether or not it can be cured. Hospice is a specific type of palliative care for people who likely have 6 months or less to live. In other words, hospice care is always palliative, but not all palliative care is hospice care.""
 'An overview of the domains of the comprehensive palliative care assessment, and a number of related topics in medical consultation and palliative care are covered elsewhere. When patients and families facing a serious and/or life-threatening illness are asked what matters most to them, comfort is a foremost concern.'
 'Palliative Care Program. Palliative care helps patients with serious illness live as well and fully as possible. It can help at all stages of illness and be provided along with other treatments. Palliative care helps treat pain, shortness of breath, fatigue, and other physical symptoms. Palliative care also provides emotional and spiritual support to patients and families, and helps them make decisions and coordinate care.'
 'Diane MF Savarese, MD. The clinical interview in palliative care is not only central to the information gathering process – to understanding and being able to address patient and family suffering – but is also a fundamental therapeutic method.'
 ""Palliative care is treatment of the discomfort, symptoms, and stress of serious illness. It can also help you deal with the side effects of the medical treatments you're receiving. Hospice care, care at the end of life, always includes palliative care. But you may receive palliative care at any stage of an illness. The goal is to make you comfortable and improve your quality of life.""
 'Consultation Codes. Hospice Services Provided by Physicians and CPT Consultation Codes. Hospice services provided by physicians must use the most appropriate E/M codes to bill for E/M services. CMS clarifies that CPT consultation codes are no longer valid for hospices, even when physician services are provided under Medicare Part A.']","Palliative Care Program is a specialized service providing pain and symptom management, counseling, support and guidance in navigating health care options and choices."
