question,context,answers
what is  the action of the  trapezius muscle to the scapula,"[""When you're looking at your back as a whole, the trapezius muscle resembles a long rhombus balancing on one point. When you look at only one side of your back, the trapezius looks like a triangle with its base along the spine. The lower trapezius is the inferior portion of the trapezius muscle.""
 'The scapula, commonly referred to as the shoulder blade, is the bone that attaches to the back of your rib cage. It is the bone that creates the shoulder joint with the upper arm, called the humerus bone. The scapulae can move in six actions and each action has primary muscles that create that action.'
 'Anatomy and supply. The trapezius muscle is a triangular, flat muscle of the shoulder girdle. It is supplied by the accessory nerve (cranial nerve XI) and the cervical plexus (C2-C4). Descending (or superior) part: runs from the occipital bone and nuchal ligament to the lateral third of the clavicle.'
 'Levator scapulae. The levator scapulae muscle is located at the side and back of the neck. It is one component of the muscular system of the shoulder. Its primary function is to lift the scapula, which is the triangle-shaped bone located at the back of the shoulder that connects the upper arm bone (humerus) with the clavicle (collarbone). If a person experiences a stiff shoulder or neck, the levator scapulae muscle is often involved.'
 'Strength Testing: Position – the subject in prone with the forehead on a small towel roll with the head in neutral. The shoulder is abducted to approximately 135º and the arm laterally rotated with thumbs pointed to the ceiling. The intent is to align the arm to the direction of the lower fibers of the trapezius. The arm is supported on the table and on the same plane as the scapula.'
 'The trapezius muscle is a triangular, flat muscle of the shoulder girdle. It is supplied by the accessory nerve (cranial nerve XI) and the cervical plexus (C2-C4). One differentiates three parts: Descending (or superior) part: runs from the occipital bone and nuchal ligament to the lateral third of the clavicle.'
 'Trapezius Muscle. The trapezius is one of the major muscles of the back and is responsible for moving, rotating, and stabilizing the scapula (shoulder blade) and extending the head at the neck. It is a wide, flat, superficial muscle that covers most of the upper back and the posterior of the neck.'
 'Scapula Depression. When the lower fibers of the trapezius contract, they pull the scapula down. This is called scapula depression. If you were to peel the skin off of your back, you would see that scapula depression lengthens the upper and middle fibers, suggesting that the lower fibers accomplish this action alone.'
 'A helpful way to learn the muscles is to get up out of your chair and move and mimic the actions for the muscles you are learning that week. Look at the picture of the muscle, find it on your body, and picture how the muscle is contracting and what muscles are involved in the movement. Make the muscle contract and complete the different actions that muscle is involved in.'
 'With loss of trapezius function, shoulder abduction is limited. o Forward flexion of the shoulder, on the other hand, requires upward rotation of the scapula by the serratus with the scapula abducted from the midline. Therefore, with abnormal trapezius function, the patient can forward flex the shoulder more.']","Moving, rotating, and stabilizing."
oceanic crust is composed primarily of ________.,"['Layers that are less dense, such as the crust, float on layers that are denser, such as the mantle. Both oceanic crust and continental crust are less dense than the mantle, but oceanic crust is denser than continental crust. This is partly why the continents are at a higher elevation than the ocean floor. Because continental crust is less dense than oceanic crust it floats higher on the mantle, just like a piece of Styrofoam floats higher on water than a piece of wood does. The mantle, oceanic crust and continental crust have different densities because they are made of different kinds of rock with different densities.'
 'Ocean crust is composed of the rock basalt, a dark, dense igneous rock image courtesy Northeastern University This rock is not similar in any way to salt (NaCl), although many people are confused because of the similarity of their names.'
 'The continental crust is made mostly of rocks with a composition similar to granite (a light-colored rock you would expect to find in the Sierra Nevada), whereas the oceanic crust is made mostly of rocks with a composition of basalt (a dark-colored rock, like the rocks that make up the Hawaiian volcanoes).'
 'Around the edge of the continental cratons are the continental margins. The continental margins are primarily composed of sedimentary rocks. These sedimentary rocks were originally laid down in the oceans.'
 'This is the reason why continents are higher than ocean basins; the basins would exist whether or not there was any water on the Earth. Their existence derives from the greater density of basalt. When we study the different types of convergent zones, we will need to remember that ocean crust is denser than continent.'
 'The oceanic crust is made out of basalts - (lava-hardened Iron/Magnesium Silicate mixtures which solidified rapidly).'
 ""oceanic crust. the portion of Earth's crust that is usually below the oceans and not associated with continental areas, thinner and higher in density that continental crust and basaltic rather than granitic in composition.""
 '· just now. Report Abuse. Continental crust is made up of Hoosier tires, and ocean crust is made up of Goodyear tires. The crust on your bread is Firestone, apparently; as far as your butt, probably Cooper. Joe Miner Joe Mama · 7 years ago. Thumbs up.'
 'TYPES OF CRUSTAL MATERIAL It is important to keep in mind when discussing plate tectonics that the crust of the Earth is composed of two basic types of crustal material. We refer to these as continental crust and oceanic crust. These types of crust differ in several ways. While both are made mostly of igneous rocks (that is, rocks that solidify from molten material), they have different compositions.'
 'When the magma hits the cold ocean waters, the material cools relatively rapidly and forms new crust along the site of the divergent zone. image courtesy USGeological Survey The image above shows a piece of heated magma in the process of cooling into basalt.']",Basalts
cast of hush,"['Hush (2016 film) Hush is a 2016 American horror thriller film directed and edited by Mike Flanagan, starring Kate Siegel, and written by both.[3] The film co-stars John Gallagher Jr., Michael Trucco, Samantha Sloyan, and Emilia Emma Graves.'
 ""Title: Hush (1998) 5.3 /10. Want to share IMDb's rating on your own site? Use the HTML below.""
 ""Cast. Kate Siegel as Maddie; John Gallagher Jr. as Man; Michael Trucco as John; Samantha Sloyan as Sarah; Emilia Graves as Max; Production. Nothing was known about the project until September 2015, when it was revealed at a buyers' screening which occurred at the 2015 Toronto International Film Festival.""
 ""Three other cast members from What Ever Happened to Baby Jane? did appear in Hush...Hush, Sweet Charlotte: Wesley Addy, Dave Willock (as a taxi driver) and Victor Buono. The cast also included Mary Astor, a friend and former co-worker of Davis' during her time at Warner Bros.""
 ""Hush...Hush, Sweet Charlotte is a 1964 American psychological thriller film directed and produced by Robert Aldrich, and starring Bette Davis, Olivia de Havilland, Joseph Cotten, Agnes Moorehead and Mary Astor in her final film role. The movie was adapted for the screen by Henry Farrell and Lukas Heller, from Farrell's unpublished short story, What Ever Happened to Cousin Charlotte? It received seven Academy Award nominations.""
 'Directed by Jonathan Darby. With Jessica Lange, Gwyneth Paltrow, Johnathon Schaech, Nina Foch. Helen is the young girlfriend of good-looking Jackson Baring. When Helen gets pregnant and marries Jackson, they decide to move to his family farm, Kilronan, and have a baby there.'
 'Hush (1998) PG-13 | 1h 36min | Drama, Thriller | 6 March 1998 (USA) Helen is the young girlfriend of good-looking Jackson Baring. When Helen gets pregnant and marries Jackson, they decide to move to his family farm, Kilronan, and have a baby there. But his ...'
 'Hush is a 2016 American horror thriller film directed and edited by Mike Flanagan, starring Kate Siegel, and written by both. The film co-stars John Gallagher Jr., Michael Trucco, Samantha Sloyan, and Emilia Emma Graves.'
 'Cast. 1  Kate Siegel as Maddie. 2  John Gallagher Jr. as Man. 3  Michael Trucco as John. 4  Samantha Sloyan as Sarah. 5  Emilia Graves as Max.'
 'In the latest episode: Arielle Kebbel dishes on how she told her parents about her Fifty Shades Freed role, and the cast of Black Panther reveals the real-life heroes that inspired their characters. Watch the show']","Casts of Hush are Kate Siegel as Maddie,John Gallagher Jr. as Man, Michael Trucco as John, Samantha Sloyan as Sarah,Emilia Graves as Max."
what is the tennessee state tax in nashville,"['You should be aware that the sales tax in Tennessee is a little higher than other states at 9.25%. Here are some of the legal reasons why Nashville and Tennessee will not have a state income tax anytime in the foreseeable future:'
 'State Tax in Tennessee: Nashville Real Estate and MLS. Tennessee is one of the few states left that does not have a state income tax. Nashville and Tennessee State Income Tax. Nashville has the added financial benefit for the working person in that their income is not subject to a state income tax. If you then combine this with the relatively low property taxes and real estate values then Nashville and Tennessee can be a very attractive place to live purely in economic terms!'
 'Nashville is the capital of the U.S. state of Tennessee and the county seat of Davidson County. It is located on the Cumberland River in the north central part of the state. The city is a center for the music, healthcare, publishing, banking and transportation industries, and home to numerous colleges and universities.'
 ""Reflecting the city's position in state government, Nashville is home to the Tennessee Supreme Court's courthouse for Middle Tennessee. According to 2015 estimates from the U.S. Census Bureau, the total consolidated city-county population stood at 678,889.""
 'The tax table below will show in detail the Tennessee state income tax rates by income tax bracket(s). There are 1 income tax brackets for Tennessee. If your income range is $0 and over, your tax rate on every dollar of income earned is 6%. Income tax brackets data last updated March 3rd, 2009.'
 'Tennessee (TN) Sales Tax Rates by City. The state sales tax rate in Tennessee is 7.000%. With local taxes, the total sales tax rate is between 8.500% and 9.750%. Food in Tennesse is taxed at 5.000% (plus any local taxes). Tennessee has recent rate changes (Fri Jul 01 2016).'
 'Preparing your download. Tennessee Tax Rates. The Tennessee (TN) state sales tax rate is currently 7%. Depending on local municipalities, the total tax rate can be as high as 9.75%. Other, local-level tax rates in the state of Tennessee are quite complex compared against local-level tax rates in other states.'
 'Tennessee has state sales tax of 7.00%, and allows local governments to collect a local option sales tax of up to 2.75%. There are a total of 113 local tax jurisdictions across the state, collecting an average local tax of 2.487%. Click here for a larger sales tax map, or here for a sales tax table.'
 'Combined with the state sales tax, the highest sales tax rate in Tennessee is 9.75% in the cities of Murfreesboro, Cleveland, Jackson, Maryville and Cookeville (and 101 other cities). Last updated March 2017.'
 'Tennessee state income tax along with a federal tax is usually withheld from your paycheck as you receive it each pay cycle. While the federal income tax rates are set for each income bracket, TN state income tax rates do not necessarily align with the federal figures.']","7% of state sales tax,Depending on local municipalities, the total tax rate can be as high as 9.75%."
starting salary of registered nurse,"['The starting salary of a Registered Nurse can range from around $28,000-$50,000 per year on average. The starting hourly wage of an RN can range from $16.50-26.00 per hour.This salary will increase over time, as nurses gain experience, certifications, and specialize in a specific area.Registered nurses can also advance their career to managment postions, in addition to regular raises offered by employers.ccording to the Bureau of Labor Statistics lastest data, the average salary of a registered nurse in the United States is $69,790. The average hourly wage of a registered nurse is $33.55.'
 '$67,930. In 2013, registered nurses made an average salary of $68,910, which is pretty good pay compared with some of the other health care professions on this year’s Best Jobs list.he highest-paid RN positions are clustered in California, including the metropolitan areas of San Francisco, San Jose and Vallejo. In 2013, registered nurses made an average salary of $68,910, which is pretty good pay compared with some of the other health care professions on this year’s Best Jobs list.'
 'According to the Bureau of Labor Statistics lastest data, the average salary of a registered nurse in the United States is $69,790. The average hourly wage of a registered nurse is $33.55.Keep in mind that these are only averages, and that a registered nurse may make more or less than these amounts based on location, experience, and other factors. In addition, the starting salaries for an RN may be much less than the average salary.ccording to the Bureau of Labor Statistics lastest data, the average salary of a registered nurse in the United States is $69,790. The average hourly wage of a registered nurse is $33.55.'
 'Salary Outlook. The BLS reports the median salary for a registered nurse was $66,220 in 2013. The best-paid 10 percent of RNs made more than $96,320, while the bottom 10 percent earned less than $45,630.he highest-paid RN positions are clustered in California, including the metropolitan areas of San Francisco, San Jose and Vallejo. In 2013, registered nurses made an average salary of $68,910, which is pretty good pay compared with some of the other health care professions on this year’s Best Jobs list.'
 'The highest-paid RN positions are clustered in California, including the metropolitan areas of San Francisco, San Jose and Vallejo. In 2013, registered nurses made an average salary of $68,910, which is pretty good pay compared with some of the other health care professions on this year’s Best Jobs list.he highest-paid RN positions are clustered in California, including the metropolitan areas of San Francisco, San Jose and Vallejo. In 2013, registered nurses made an average salary of $68,910, which is pretty good pay compared with some of the other health care professions on this year’s Best Jobs list.'
 'Salary. The BLS reports the median salary for a registered nurse was $66,220 in 2013. The best-paid 10 percent of RNs made more than $96,320, while the bottom 10 percent earned less than $45,630.alary. The BLS reports the median salary for a registered nurse was $66,220 in 2013. The best-paid 10 percent of RNs made more than $96,320, while the bottom 10 percent earned less than $45,630.'
 '1 The salary of 90% RNs was less than $96,320; while the salary of 10% RNs was more than $96,320. 2  75% made below $80,190; 25% made more than $80,190. 3  50% earned less than $66,220; the other 50% got above $66,220.4  25% were remunerated less than $54,180; while remaining 75% were compensated more than $54,180. 90% RNs made less than $46.31 per hour; 10% RNs made above $46.31. 2  75% earned less than $38.55; 25% earned more than $38.55. 3  The income of 50% employees was below $31.84 per hour; while the other 50% enjoyed hourly salary more than $31.84.'
 'Hospitals hire registered nurses with a two-year associate degree in nursing from a junior or a community college and pay first year salaries slightly below $44,000 according to May 2011 estimates from the Bureau of Labor Statistics, or BLS.ospitals hire registered nurses with a two-year associate degree in nursing from a junior or a community college and pay first year salaries slightly below $44,000 according to May 2011 estimates from the Bureau of Labor Statistics, or BLS.'
 ""Other Care Facilities. Three other common employers of registered nurses offered very different types of care. The third-largest employer was home health care, where 156,730 RNs averaged $65,120 a year. Starting salaries might fall between $42,880 and $51,480 a year.he second-largest number of RNs worked in doctors' offices, where 235,710 averaged $72,890 a year in pay, slightly higher than at hospitals. Starting salaries might fall in a lower range of between $40,760 and $50,820 a year.""
 'For example the median expected annual pay for a typical Staff Nurse-RN in the United States is $70,076, so 50% of the people who perform the job of Staff Nurse-RN in the United States are expected to make less than $70,076. Source: HR Reported data as of October 2015. 1  Salary.2  Salary + Bonus.3  Benefits. 4  Purchase Full Report.he annual salary for someone with the job title Staff Nurse-RN may vary depending on a number of factors including industry, company size, location, years of experience and level of education.']","$28,000-$50,000 per year"
average pulse rate for male adults,"[""· just now. Asker's rating. Report Abuse. The normal resting heart rate for an adult is between 60 and 100 beats per minute (bpm). that can vary with the person's level of cardiovascular fitness-for example, an olympic athlete may have a resting heart rate of 45-50 bpm and be perfectly healthy.he expected resting heart rate (when not exercising) for a healthy child is between 80 and 90 beats per minute, for a healthy adult female approximately 75 beats per minute, and for a healthy adult male an approximate figure of 70 beats per minute. THE GENIUS · 6 years ago.""
 'A normal resting heart rate for adults ranges from 60 to 100 beats a minute. Generally, a lower heart rate at rest implies more efficient heart function and better cardiovascular fitness.For example, a well-trained athlete might have a normal resting heart rate closer to 40 beats a minute. normal resting heart rate for adults ranges from 60 to 100 beats a minute. Generally, a lower heart rate at rest implies more efficient heart function and better cardiovascular fitness.'
 'Most adults have a resting heart rate of 60-100 beats per minute (bpm). The fitter you are, the lower your resting heart rate is likely to be. For example, athletes may have a resting heart rate of 40-60 bpm or lower.You should contact your GP if you think your heart rate is continuously above 120 bpm or below 40 bpm, although this could just be normal for you.he fitter you are, the lower your resting heart rate is likely to be. For example, athletes may have a resting heart rate of 40-60 bpm or lower. You should contact your GP if you think your heart rate is continuously above 120 bpm or below 40 bpm, although this could just be normal for you.'
 'For adults 18 and older, a normal resting heart rate is between 60 and 100 beats per minute (bpm), depending on the person’s physical condition and age. For children ages 6 to 15, the normal resting heart rate is between 70 and 100 bpm, according to the AHA.or adults 18 and older, a normal resting heart rate is between 60 and 100 beats per minute (bpm), depending on the person’s physical condition and age. For children ages 6 to 15, the normal resting heart rate is between 70 and 100 bpm, according to the AHA.'
 ""Infants have the fastest heart rate (120-160 bpm) and it slows as they age. A young adult male in average health will have a resting pulse of 60-100 bpm and a female will have a slightly higher rate (on average.) 93 perfectly normal if you are an adult.Source(s): I'm a university Anatomy and Physiology instructor.Bio Instructor · 8 years ago. young adult male in average health will have a resting pulse of 60-100 bpm and a female will have a slightly higher rate (on average.) 93 perfectly normal if you are an adult. Source(s): I'm a university Anatomy and Physiology instructor. Bio Instructor · 8 years ago.""
 'Strength of the pulse. The normal pulse for healthy adults ranges from 60 to 100 beats per minute. The pulse rate may fluctuate and increase with exercise, illness, injury, and emotions. Females ages 12 and older, in general, tend to have faster heart rates than do males.trength of the pulse. The normal pulse for healthy adults ranges from 60 to 100 beats per minute. The pulse rate may fluctuate and increase with exercise, illness, injury, and emotions. Females ages 12 and older, in general, tend to have faster heart rates than do males.'
 'The normal pulse rate for adult males is between 60 and 100 beats per minute.he normal pulse rate for an adult is 60 to 100 beats per minute.'
 'An athletic male between the ages of 18 and 25 will often have a resting heart rate of 49 to 55 beats per minute. A person in this age group of below-average health might have a resting heart rate between 74 and 81 beats per minute, according to Top End Sports.n athletic male between the ages of 36 and 45 often has a resting heart rate of 50 to 56 beats per minute, while someone of the same age with below-average health can experience a rate of 76 to 82.'
 'The expected resting heart rate (when not exercising) for a healthy child is between 80 and 90 beats per minute, for a healthy adult female approximately 75 beats per minute, and for a healthy adult male an approximate figure of 70 beats per minute.THE GENIUS · 6 years ago.he expected resting heart rate (when not exercising) for a healthy child is between 80 and 90 beats per minute, for a healthy adult female approximately 75 beats per minute, and for a healthy adult male an approximate figure of 70 beats per minute. THE GENIUS · 6 years ago.'
 '1 Normal values for pulse rate depend on age and fitness level. 2  A normal adult has a pulse rate of 72 per minute and an athlete s pulse rate maybe below 50 per minute. 3  Patients with an average resting pulse rate above 70 beats per minute can have a slightly higher incidence of heart attacks. Normal values for pulse rate depend on age and fitness level. 2  A normal adult has a pulse rate of 72 per minute and an athlete s pulse rate maybe below 50 per minute. 3  Patients with an average resting pulse rate above 70 beats per minute can have a slightly higher incidence of heart attacks.']",60 to 100 beats a minute.
how dissolve pills faster,"['Some pills are completely water soluble and therefore would dissolve in water faster than other liquids which are a mixture of water with other compounds. In some cases the sugar in Kool Aid and in Cola may cause some inhibition of the dissolution process.'
 'Best Answer: Actually it depends on the pill as to which of the above would cause dissolution to occur more rapidly. Some pills are completely water soluble and therefore would dissolve in water faster than other liquids which are a mixture of water with other compounds.'
 'Taking the pill with hot or cold water will it dissolve faster or slower respectively. T … here are factors that could make the pill dissolve slower-if there are other food items in your stomach or if you take the pill with milk.'
 ""T … here are factors that could make the pill dissolve slower-if there are other food items in your stomach or if you take the pill with milk. So taking the pill with plain cold water is fine as that's what the normal case when pills are tested.""
 ""Of course, in the stomach, there is heat and acid to help digest things and break down pills, but I don't have a good way to simulate that. In any case, if you drink a cup of water with your analgesic of choice, you will dilute the acid in the stomach significantly and reduce the temperature as well.""
 ""3. Pills designed to be slow-release. These won't dissolve well in water OR acid, though they'll eventually dissolve in either. It really depends on what they use to make it slow-release, however. In general, I'd recommend doing your science project with the following liquids: 1. Water.""
 'Pain pills are important to everyone. In order to get the best cure for pain like a headache, one needs the fastest dissolving pill. The faster a pill dissolves the faster it will get in the system and help with whatever problem exists. Dissolution is the act or process of breaking up into parts or disintegration.'
 'INTRODUCTION: Dissolvable pain relief tablets can offer many benefits that a standard pill or tablet cannot. When medications are dissolved in a liquid they can be absorbed more quickly and decrease the instances of high dose concentrations which can decrease stomach upset from irritation to the mucous membranes.'
 'This is a science project for the science fair, in which we timed how fast different types of pills would dissolve in different liquids!'
 'Thanks for watching! This is a science project for the science fair, in which we timed how fast different types of pills would dissolve in different liquids!']",Some pills are completely water soluble and therefore would dissolve in water faster than other liquids which are a mixture of water with other compounds.
